"project__PROJECT_NUMBER"	"project__PROJECT_TITLE"	"project__source_url"	"project__PROJECT_START_DATE"	"project__PROJECT_END_DATE"	"project__PROJECT_OBJECTIVE"	"agency_index__aid"	"investigator_data__name"	"investigator_index__inv_id"
"RES-355-25-0015"	"Understanding Individual Behaviour through human/animal relations"	"http://researchcatalogue.esrc.ac.uk//grants/RES-355-25-0015/read"	"2009"	"2010"	"One important way of improving our understanding of human behaviour is to look at the myriad forms of human interaction with non-human animals, whether they are wild animals, farm animals, companion animals and so on. Different forms of relation, such as those based upon empathy knowledge and nurturance, operating in different socio-spatial and temporal contexts, has a major influence on human behaviour and on the choices individual humans make. To what extent are food choices influenced by what we know about the lives of the animals whose products we consume?  Does care for a companion animal help us to act differently toward other humans and non-humans?  Has concern for the natural environment and its constituent non-humans highlighted a new ecological dimension to the impact of human-animal relations on individual human behaviour?  Through workshops, work shadowing exercises and a conference, this Exploratory Network Award (2009-2010) brings together researchers from a wide range of disciplines to develop a more integrated and coherent investigation of the many and various influences of human-animal relations on individual human behaviour, across a number of different relational contexts, at different stages in human lives and in terms of different behavioural and thus societal outcomes. "	"81"	"Buller, Henry"	"-1"
"RES-000-22-3187"	"Comparative Statics: Theory and Applications"	"http://researchcatalogue.esrc.ac.uk//grants/RES-000-22-3187/read"	"2009"	"2011"	"How do consumers respond to a fall in house prices?  How will the price of food be affected by an increase in the price of oil?  How do investors change their investment strategies in response to greater uncertainty in the financial markets?   These typical economic questions are all problems of comparative statics, which deals with the manner in which agents in an economic model vary their behaviour as the environment changes. Mathematicians and economists have developed tools for studying such problems; these tools enable economists to identify the precise conditions under which a particular phenomenon can arise in an economic model.    The principal objective of this project is to develop these tools further, so as to address problems arising in new models that cannot be easily solved using existing methods.   One issue concerns the conditions under which the solutions to certain optimisation problems vary monotonically with the parameters.   Another interesting issue is the way in which economic agents value and respond to new information.  A model's comparative statics prediction can also be used to test the validity of a model; a closely related objective in this project is to develop such tests.          "	"81"	"Quah, John"	"-1"
"RES-229-27-0006"	"The development of sustainable, multi-functional landscapes in rural areas: a case study of a Norfolk Broads river valley"	"http://researchcatalogue.esrc.ac.uk//grants/RES-229-27-0006/read"	"2008"	"2011"	"The Norfolk Broads is a unique and fragile landscape, truly multifunctional in providing wildlife habitat, recreational space, food and other materials, and employment. Recreational and tourism use of the area is likely to grow, but development and land use change to support this must be carefully managed to keep the multiple functions of the landscape in balance and ensure sustainability. The Ant Valley will be used as a case study. Likely developments will be forecast, with input from relevant interest groups, and initial scenarios showing possible changes over the next 10 years will be formulated. The likely effects of these scenarios will then be assessed. Measures of biodiversity and ecosystem function will be examined, including ways in which tourism and recreation developments could enhance them. The effects on the local rural economy, through visitor numbers and tourism spending, changes to farm incomes, and valuation of ecosystem services, will also be examined. These sets of information will be combined to give an overview of the likely costs and benefits associated with the scenarios, which will be presented back to stakeholders to assess the scenarios' acceptability. The study will also assess the limitations of the methods involved in compiling the desired information. "	"81"	"Appleton, Katheryn"	"-1"
"RES-066-27-0015"	"Transitions in practice: climate change and everyday life"	"http://researchcatalogue.esrc.ac.uk//grants/RES-066-27-0015/read"	"2008"	"2012"	"This climate change leadership fellowship addresses the need for new ways of framing problems of climate change, consumption and demand. To date, governments have sought to improve the efficiency with which contemporary 'standards' of everyday life are maintained. It is now clear that policy and governance actors have to go further and that systemic transitions in practice - in patterns of sociability and mobility, and of comfort, cleanliness, food provisioning and leisure - are also required. The fellowship aims to: 1. Develop understanding of how complex systems of practice and consumption emerge, persist and disappear - and with what consequence for the spatial and temporal ordering of daily life and the potential for mitigating or adapting to climate change. 2. Extend the range of social theoretical input to climate change policy by generating and encouraging new forms of academic and non-academic interaction. 3. Discover how social scientific analyses of systemic transitions in practice have shaped climate change policy and governance in other countries and contexts - and what lessons can be learned for the UK. Designed around a programme of research and writing, the fellowship involves running conferences, setting up a social-change climate-change working party and supervising two associated studentships. "	"81"	"Shove, E"	"-1"
"PTA-026-27-1982"	"Local Consumption and Multiculturalism"	"http://researchcatalogue.esrc.ac.uk//grants/PTA-026-27-1982/read"	"2008"	"2009"	"Investigating everyday lives in multi-ethnic societies is not necessarily confined to questions of cultural difference. During everyday practices, such as shopping for food, a multitude of encounters with the 'Other' occur, without being recognized as such. Research on small grocery stores and their customers in Germany suggests that the alleged globalisation of consumption patterns does not always lead to cultural homogenisation. There is growing evidence that local consumption cultures are resilient to change or develop alternative trajectories to the economic mainstream. These insights are to be brought into the public realm by articles and conference papers as well as presentations aimed at local authorities, chambers of commerce and shopkeepers in the UK and Germany. Researching everyday practices and places proved to be highly productive of new insights. To take this approach further the fellow will seek to secure funding for subsequent research projects and improve the likely outcomes of the research through personal development and training. The achievement of these different strands of work will hopefully cumulate to a position which allows the fellow to formulate and develop further critical research into the realm of everyday practices and places."	"81"	"Everts, Jonathan"	"-1"
"RES-168-26-0125"	"Pond slime to the rescue: Using algae to capture CO2"	"http://researchcatalogue.esrc.ac.uk//grants/RES-168-26-0125/read"	"2008"	"2008"	"Mention algae to most people and they think of green slime on their ponds, or occasionally kelp beds in the sea. But these simple plants are incredibly diverse and are found in all aquatic habitats including lakes, rivers and oceans, even the soil. They are of immense importance to global CO2 fixation, since it is estimated that marine species of algae account for about half of the world’s photosynthesis. There is currently considerable interest in exploiting these organisms for biofuel production: they grow much faster than land-based plants, some species can accumulate very high amounts (>50% dry weight) of oil, and they do not compete with food crops. However, there are many different hurdles that must be overcome before algal biofuels can be commercially viable, not least that our understanding of algal biology lags behind that of higher plants."	"81"	"Smith, Alison"	"-1"
"RES-000-22-2454"	"The Demand for Durables in the Second Half of Life in the UK"	"http://researchcatalogue.esrc.ac.uk//grants/RES-000-22-2454/read"	"2008"	"2009"	"This project shall help to better understand the demand for durables, in particular at the time of retirement entry and generally in the second half of life. While nondurable demand and large durables like housing have been studied extensively, the replacement of smaller durables like white goods, electronic appliances and the like is understudied. This project aims at explaining why the demand for durables experiences a temporary increase around retirement and a substantial decline at older ages. The empirical regularities shall be investigated in detail using three separate UK datasets - the Expenditure and Food Survey, the British Household Panel Survey and the English Longitudinal Study of Ageing. The key questions in this project are: Durable purchases at retirement: do households postpone durables purchases before retirement and use lump-sum payments received upon retirement to replace and renew their household appliances and consumer electronics? Do complementarities between durables and leisure affect purchase behaviour around retirement? Durable purchases beyond retirement: how can we explain the large drop in durables expenditures at older ages? Do households rationally take into account their life expectancy when making durables replacement decisions?  "	"81"	"Luehrmann, Melanie"	"-1"
"RES-062-23-0533"	"Testing the efficacy and mechanisms of collaborative implementation intentions"	"http://researchcatalogue.esrc.ac.uk//grants/RES-062-23-0533/read"	"2007"	"2010"	"Recent research indicates that asking people to plan in advance of action, when, where and how to perform behaviour for themselves, enhances the probability of action. This manipulation or ‘implementation intentions’, has been shown to increase the likelihood that various behaviours are performed. However, the long-term efficacy of this technique has rarely been tested, and where it has, the results have been mixed. Moreover, there have been few attempts to strengthen the impact of this manipulation. Termed ‘collaborative implementation intentions’, Prestwich et al. (2005) modified standard implementation intention interventions by requiring individuals to decide, with another person, the context in which they will enact behaviour together. In this study, collaborative implementation intentions were particularly effective in promoting breast self-examinations over one month. The current research will examine the efficacy of individual verses collaborative implementation intentions in promoting two health behaviours. Furthermore, the mechanisms through which the interventions change behaviour will be examined in order to design and develop new, effective health behaviour strategies in the future. The research will employ two randomized controlled trials, focused on exercise promotion and the reduction of high-fat food intake, in samples of council workers over a six month period. "	"81"	"Conner, Mark"	"-1"
"PTA-026-27-1446"	"Agricultural Biotechnology and Civil Society in sub-Saharan Africa"	"http://researchcatalogue.esrc.ac.uk//grants/PTA-026-27-1446/read"	"2007"	"2008"	"This Postdoctoral Fellowship will advance our understanding of the creation of research and innovation capabilities in developing countries – highlighting the roles of non-governmental organisations in the specific case of agricultural biotechnology in Africa.  The overarching objective of the fellowship is to prepare the investigator for a career as an interdisciplinary researcher and science policy analyst, where he will work to extend the application of science and technology studies (STS) in developing countries. Through communication and dissemination of the PhD thesis, the investigator aims to theoretically link STS and development studies, particularly by extending the critical civil society approach to analyses of biotechnology developed in PhD. Through engagement with stakeholders, the fellowship will contribute to policy and verify findings to develop a future research agenda. "	"81"	"Harsh, Matthew"	"-1"
"RES-229-27-0001"	"Re-inventing the wheel? Farm health planning, 1942-2006"	"http://researchcatalogue.esrc.ac.uk//grants/RES-229-27-0001/read"	"2007"	"2011"	"This project examines the history of farm health planning (FHP), an activity which lies at the heart of the Department for Environment, Food and Rural Affairs’ (DEFRA) current strategies for animal health and welfare and veterinary surveillance, and features strongly in its considerations of future veterinary services. Formerly known as veterinary preventive medicine, FHP has been pursued in different forms and with varying degrees of success, throughout the post-WWII era. Combining a critical analysis of the science and practice of FHP, 1942-2010, with an investigation into its economic, social and political aspects, this research reveals how and why vets, farmers, scientists and government officials problematised and addressed impediments to production, and with what effects. It shows how disease targets were selected, the assumptions, approaches and outcomes of research relating to them, and the framing, selection and implementation of administrative and technical methods for their resolution. Historical findings are used to analyse present-day policy making, and form a basis for definite recommendations on the future framing, implementation and evaluation of FHP. "	"81"	"Woods, Abigail"	"-1"
"RES-000-22-2003"	"The Impact of New Health Imperatives on Schools"	"http://researchcatalogue.esrc.ac.uk//grants/RES-000-22-2003/read"	"2007"	"2009"	"The drive to tackle a so called ‘obesity epidemic’ has resulted in extensive Government funding to support a number of health policies and school based initiatives (eg, annual weight checks, fingerprint screening in school canteens, removal of vending machines) to monitor and regulate young people’s weight, physical activity patterns and diets. This research project will explore how these health measures are being re-contextualised in schools, and impact young people’s and teacher’s identities, health, well being and rights, in light of evidence that increasing numbers of adults and young people are now experiencing forms of body dissatisfaction and problematic relationships with food and physical activity. The study is grounded in case study methodology:  Questionnaire and Interview data from both teachers and pupils will be collected across a sample of secondary schools in the UK, along with a thorough analysis of current health policy materials within selected schools. The study will form part of a wider international collaborative research project with partner institutions in New Zealand and Australia. Collectively, these sociological studies will provide a unique contribution to emerging international debates on obesity, health policy and young people. "	"81"	"Rich, Emma"	"-1"
"RES-168-26-0077"	"Do you know your brain? Engaging shoppers in Manchester"	"http://researchcatalogue.esrc.ac.uk//grants/RES-168-26-0077/read"	"2007"	"2007"	"Shoppers at the ASDA-Walmart Supercentre (Eastlands, Manchester) on 12 or 15 March were not confronted by food adverts at the store entrance but a six foot high image of the brain! This was all part of the ‘Brain Activity Stand’ being run by young scientists from the University of Manchester as part of National Science and Brain Awareness Week. More than 20 scientists, from undergraduate to lecturer, from the Faculty of Life Sciences and School of Psychological Sciences braved the elements to help the visiting shoppers ‘make sense of their brain’. Participants tested their sense of smell and saw whether it brought back fond, or not so fond, memories. They stared in disbelief when colours appeared on a spinning black and white disk, tried their best at catching plastic fish while using only one eye and found out if their finger tip or forearm was more sensitive. They also got to take apart a model brain and learn which sense each part was linked with. The event was a huge success and a brain stress ball was the reward for anyone taking part!"	"81"	"Allan, Stuart"	"-1"
"RES-168-26-0068"	"Hands-on Plants"	"http://researchcatalogue.esrc.ac.uk//grants/RES-168-26-0068/read"	"2007"	"2007"	"Warwick HRI organised and hosted an interactive science day for key stage 2 primary school children. Emphasis was for hands-on scientific experiments designed to increase their knowledge and understanding of science, of plants and of horticulture in particular. Aim 1: Inspire and enthuse 240 Key Stage 2 primary school children by allowing them to participate in science activities.  Achieved - 340 children plus their supporting staff took part in the event.  Aim 2: Provide teachers with two projects to continue in the classroom or at home, taking science to the wider community.  Achieved - Each child took a Brassica plant back to the classroom.  Some were given wild varieties, others cabbage and broccoli.  Visually similar as seedlings, over time they will see differences develop.  Each child also had a mini mushroom kit. Aim 3: Ten Warwick HRI scientists will develop communication skills.  Achieved - 25 Warwick HRI scientists took part in manning the stands and working with the children on each of the exhibits. An unexpected outcome of this was the sense of team building achieved."	"81"	"Napier, Richard"	"-1"
"RES-000-22-2066"	"New methods for forecasting inflation and its sub-components: Applications to the UK, USA and South Africa"	"http://researchcatalogue.esrc.ac.uk//grants/RES-000-22-2066/read"	"2006"	"2008"	"The aim is to forecast the chief components of inflation (such as changes in fuel prices, food prices and prices of durable goods) for the USA, UK and South Africa, and to test whether the weighted sum of the component forecasts gives a more accurate overall forecast for inflation, than simply forecasting overall inflation itself. In the long run, the ratios of these prices to the overall consumer price index have altered because of technological changes and globalization, among other factors. For example, the prices of internationally traded consumer goods have fallen relative to prices of services. By building separate models for the components, the long-run information in the data and specific economic features likely to drive each component can be exploited. These models will test for asymmetries, such as the tendency of petrol prices to respond faster to rises than to falls in oil prices. The models should help better understand the causes of overall inflation through understanding the inflation trends of the underlying sectors. Modelling the components separately should also highlight where interest rate policy could be effective, and where other policies such as competition policy or price regulation might have complementary benefits. "	"81"	"Aron, Janine"	"-1"
"RES-568-28-5001"	"Centre for Business Relationships Accountability, Sustainability and Society"	"http://researchcatalogue.esrc.ac.uk//grants/RES-568-28-5001/read"	"2006"	"2013"	"BRASS exists to understand, promote and ""mainstream"" the key issues of sustainability, accountability and social responsiveness, through research into key business relationships. This involves a focus on industry supply-chain relationships, and also an emphasis on relationships between businesses and a range of stakeholders including consumers, employees, investors, regulators and communities. Many of the Centre's projects are based in its three key industries of food, electronics and automotive. It is also developing new research streams in other industries including financial and professional services, waste management, construction and health. BRASS's work aims to produce: - New knowledge and understanding about the significant changes occurring in the relationships amongst businesses and their stakeholders, relating to their environmental and social impacts; - Partnerships with commercial and public sector organisations to both conduct research and implement changes based on our research findings and expertise; - Communications initiatives and educational contributions which will inform and promote the debate about business sustainability and corporate social responsibility "	"81"	"Peattie, Ken"	"-1"
"RES-173-27-0006"	"Taking Forward DEFRA's Evidence Based Policy Approach"	"http://researchcatalogue.esrc.ac.uk//grants/RES-173-27-0006/read"	"2006"	"2007"	"The present focus on policy being based upon evidence – or at least informed or bounded by it - is commonly dated to the Modernising Government White Paper. Although there has been extensive consideration of how stakeholder and public views might inform policy across many facets of public life, there has been little work exploring how this links with the development of evidence based policy. Within the Department for Environment, Food and Rural Affairs there is a growing exploration of participative methods of engagement. It is however formal written consultation that is routinely used as part of the policy making process. Although within academia such a mechanism is often considered inferior to more deliberative forms of engagement, time and resource constraints across government are likely to mean that it remains an important interface with stakeholders and publics for the foreseeable future. The aim of this research is to explore the present and potential role of formal consultation processes in relation to developing evidence based policy. This will be explored in relation to the academic literature and government consultation guidance. A series of case studies and ‘lessons learned’  around consultations in DEFRA will be developed across a range of policy areas.  "	"81"	"Barnett, Julie"	"-1"
"RES-173-27-0007"	"Stakeholder Engagement in Developing Policy Based on Evidence From Wellbeing Research"	"http://researchcatalogue.esrc.ac.uk//grants/RES-173-27-0007/read"	"2006"	"2007"	"The UK Government’s Sustainable Development Strategy ‘Securing the Future’ commits the Government to “sponsor cross-disciplinary work to bring together existing research and international experience and to explore how policies might change with an explicit wellbeing focus”. Using skills and knowledge gained from working in the Wellbeing in Developing Countries (WeD) ESRC Research Group based at the University of Bath, this placement with the Department of Environment, Food and Rural Affairs (DEFRA) will contribute towards the UK’s Sustainable Development Strategy to conduct a research programme into wellbeing. It will also assist in leading discussions with stakeholders on how policies might change with an explicit wellbeing focus. Likely tasks during the placement will include: Synthesising outputs from research on wellbeing to inform stakeholder discussions Advising on any further research that might be needed Delivering stakeholder seminars and workshops on wellbeing Developing mechanisms for ongoing dialogues with policymakers, policy practitioners and academic experts, eg virtual forum. This will draw from experience of two DEFRA pilots to develop participative online discussion techniques. Facilitating stakeholder discussions. Research paper to be presented on use of cross cutting research to inform policy discussions and formulation. "	"81"	"Newton, Julie"	"-1"
"RES-145-28-1003-A"	"ESRC Centre for Economic and Social Aspects of Genomics (CESAGen)"	"http://researchcatalogue.esrc.ac.uk//grants/RES-145-28-1003-A/read"	"2006"	"2007"	"CESAGEN is an interdisciplinary and inter-institutional site for fundamental and strategic research on the social, ethical and economic contexts and consequences of genomics and genetic science. A collaboration between Lancaster and Cardiff Universities which is pursuing multidisciplinary social science research in collaboration with natural scientists and will address topics such as stem cell research, animals and biotechnology and pharmacogenetics, with special reference to cross-cutting themes of globalisation and public engagement. It will covers six research themes: Genomics and the Transformation of Knowledge Production Genomics, Economics and Innovation Genomics, Ethics and Regulation Genomics, Identity and Social Organisation Genomics, Risk and Responsibility Genomics, Global Discourse and Cultural Capital.      Website: www.genomicsnetwork.ac.uk/cesagen "	"81"	"Chadwick, Ruth"	"-1"
