"project__PROJECT_NUMBER"	"project__PROJECT_TITLE"	"project__source_url"	"project__PROJECT_START_DATE"	"project__PROJECT_END_DATE"	"project__PROJECT_OBJECTIVE"	"agency_index__aid"	"investigator_data__name"	"investigator_index__inv_id"
"RES-227-25-0014"	"Collaborative Frameworks in Land Management: A Case Study on Integrated Deer Management"	"http://researchcatalogue.esrc.ac.uk//grants/RES-227-25-0014/read"	"2006"	"2009"	"This project aims to produce a generic framework for effective, informed and inclusive collaborative management to promote rural sustainability, using wild deer as a case study. There are many different and conflicting attitudes to deer and how best to manage them. Deer management provides jobs in rural areas and the meat industry and tourists are drawn to areas to see deer and the landscapes that they help to create. However, in some areas, high deer numbers cause overgrazing and damage to sensitive natural habitats, agricultural crops, forestry and suburban gardens. Deer are increasingly involved in road accidents. This project will investigate how well people involved in deer management work together and how this can be improved to minimise costs and maximise the benefits. Workshops, focus groups and in-depth interviews with policy makers, practitioners, researchers and the public across different scales and levels of complexity will be used to identify the various issues and barriers to collaboration and how they can be overcome. By increasing the understanding of the issues between ecologists, economists and social scientists and combining this knowledge with management objectives, to improve deer management, a framework for collaborative management of an ecological resource will be developed. "	"81"	"Irvine, R"	"-1"
"RES-227-25-0006"	"An Integrated Analysis of Scale Effects in Alternative Agricultural Systems"	"http://researchcatalogue.esrc.ac.uk//grants/RES-227-25-0006/read"	"2006"	"2010"	"Changing land cultivation from conventional to organic practices can have significant impacts on environmental factors such as wildlife, soil and water quality, as well as change the ways in which food is supplied, the economics of farm business and indeed the attitudes of farmers themselves. A factor that is little understood is how these depend on the scale and concentration of alternative farming systems across the landscape, from local up to the national scale. This project addresses two key questions: What causes organic farms to be arranged in clusters at local, regional and national scales, rather than be spread more evenly throughout the landscape? Assess how the ecological, hydrological, socio-economic and cultural impacts of organic farming may vary due to neighbourhood effects at a variety of scales. The project will undertake an intensive study of existing clustered and isolated organic farms, and their surrounding neighbourhoods, to address these questions. It will culminate in mapping out some alternative scenarios for future growth of the organic sector in the UK, and evaluate the potential positive and negative effects that different patterns of organic cultivation might have, at a variety of scales, in the future. "	"81"	"Stagl, Sigrid"	"-1"
"RES-000-22-3653"	"Bilateral (Hong Kong): Innovative Management Practices and Firm Performance: A Quasi-natural Experiment within a Private Manufacturing Firm in China"	"http://researchcatalogue.esrc.ac.uk//grants/RES-000-22-3653/read"	"2009"	"2012"	"The project will study ""high performance work systems"" and company performance in the plants of a large Chinese food/noodle manufacturing firm. The principal investigators are Stan Siebert and Xiangdong Wei (Lingnan University, Hong Kong), with John Heywood of Wisconsin-Milwaukee as co-investigator. The aim is to find the root of China's world-beating productivity, and in particular to assess how the company has adapted to China's relatively high levels of labour regulation. (as measured, for example, by the World Bank's current Ease of Doing Business Report). The company is experimenting with various innovative labour practices such as team-working and incentive pay schemes, and the results will be tracked. A further aspect of the research is assessing the consequences of these practices for workers, by conducting periodic job satisfaction surveys. The project addresses central concerns of personnel economics and strategic human resource researchers. The evidence on the high performance paradigm tends to be distorted by omission of the management ability factor which our quasi-experimental approach avoids. In fact, our results may well not support the paradigm, or support a ""contingency"" view whereby high performance practices improve outcomes when applied to some worker groups (eg full-timers), but not when applied to others. "	"81"	"Siebert, Stan"	"-1"
"ES.L001055.1"	"'Behaviour change' past, present and future: interdisciplinary responses to behaviour change in policy and research"	"http://researchcatalogue.esrc.ac.uk//grants/ES.L001055.1/read"	"2014"	"2017"	"This research takes the form of nine inter-disciplinary seminars over three years. The series, entitled 'Behaviour change' past, present and future: interdisciplinary responses to behaviour change in policy and research’, has three aims: in response to the limited effectiveness of communication of research insights between academia and government, the seminars will provide a platform for improved dialogue between these groups based on concerns about the lack of rigorous evidence around some behaviour change approaches, the seminars will provide a forum for exploring research innovation given the need for interdisciplinary responses to ‘behaviour change’ challenges, the series will provide a structured forum for different disciplines to develop an interdisciplinary agenda. The three hour seminars will commence with an introductory session highlighting a range of key topics at the forefront of behaviour change research, policy and practice. Thereafter, seven seminars will focus on a particular topic of high social interest. These are obesity, food and physical activity; alcohol, drug and smoking; sustainable behaviours; corporate ‘behaviour change’; mobility behaviours; civic engagement; online security/ privacy. The final seminar will synthesise cross-cutting issues and set future plans for research, application and publication."	"81"	"Spotswood, Fiona"	"-1"
"RES-167-25-0746"	"Farm scale and viability: an assessment of black economic empowerment in sugar production in Mpumalanga Province, South Africa."	"http://researchcatalogue.esrc.ac.uk//grants/RES-167-25-0746/read"	"2011"	"2015"	"Land reform remains a key element in efforts to redress South Africa’s legacy of historic injustice, but is an arena of intense debate about the impact of farming scale on agricultural productivity and rural incomes. This research will undertake a study of sugar farms in Mpumalanga province, South Africa, where, following land reform, black-owned agriculture operates on both small- and large-scale production units. The research will collect and analyse new data using farm surveys and interviews with farm owners and employees, as well as analysing existing data. The three-year project will use a range of criteria of ‘farm viability’ to assess: the productivity of land, water, labour and capital at different farm scales; the impact of income from different scales of farming on livelihoods and wellbeing among rural communities; and the effects of sugar farming on political and institutional relations within rural communities, particularly with respect to conflict and cohesion over natural resource use. While the main policy lessons from this research will focus on the South African land and agriculture context, the research will also seek to identify lessons for policy on foreign financial investment in farmland in sub-Saharan Africa."	"81"	"Woodhouse, Philip"	"-1"
"RES-576-25-0053"	"NOVELLA (Narratives of Varied Everyday Lives and Linked Analyses)"	"http://researchcatalogue.esrc.ac.uk//grants/RES-576-25-0053/read"	"2011"	"2015"	"This research node is concerned with the everyday habitual practices of families. These are frequently taken for granted. Since people’s understanding of what they do (their everyday practices) is not necessarily what they actually do, it might seem that what they say is of little interest to policymakers and practitioners. Yet, 'disconnections' between people's understanding and action tells us about their identities, values and possible future actions. Family practices are of particular interest since orientation to the social world and what people do are negotiated within families. The research node aims to provide new knowledge about families' practices, to situate these in wider social and cultural contexts and to examine differences between narratives and everyday practices. It consists of three highly socially relevant research projects on family practices that are of concern to policymakers and practitioners. These are: Parenting Identities and Practices Families and food: Methodological innovations for studying habitual practices Family lives and climate change: Cross-national (India, UK) perspectives on habitual practices. The node will contribute to building research capacity and expertise in secondary analysis and in comparing narrative analysis with other research methods through training courses, workshops and resources displayed on an easily-accessible node website.   "	"81"	"Phoenix, Ann"	"-1"
"ES.K006169.1"	"How States Account for Failure in Europe (HowSAFE): Risk and the Limits of Governance"	"http://researchcatalogue.esrc.ac.uk//grants/ES.K006169.1/read"	"2013"	"2016"	"‘Risk-based’ approaches to governance are increasingly internationally promoted as universally applicable foundations for improving the quality, efficiency, and rationality of governance across policy domains. Premised on the idea that governance cannot eliminate all adverse outcomes, risk-based approaches take into account both the probability as well as the impact of potential adverse governance outcomes. In so doing, such approaches provide a means of rationalising the limits of what governance interventions can, and should, achieve. However, such approaches embody particular understandings about the meaning of governance 'failure' and 'success' and as such can conflict with governance norms and accountability structures as well as societal expectations. HowSAFE will undertake a comparative investigation of the factors shaping the adoption of risk-based approaches to governance across six policy domains-occupational health and safety, flooding, food-safety, healthcare, criminal justice and education - in four European countries-France, Germany, Netherlands and UK. In so doing, it will: document the application of risk-based governance across policy domains and national settings compare the application of risk instruments within and between policy domains explain the factors driving and constraining risk-based governance in Europe, and will reflect more broadly on how states account for failure and the limits of governance.   "	"81"	"Rothstein, Henry"	"-1"
"ES.K001426.1"	"Harnessing Enthusiasm: Ecosocialities and Citizens as Early-Warning Systems"	"http://researchcatalogue.esrc.ac.uk//grants/ES.K001426.1/read"	"2012"	"2013"	"Dr Hilary Geoghegan will explore the social, scientific and technological practices required to harness citizen enthusiasm in developing sustainable citizen science for monitoring tree health. Citizen science is an activity that is becoming increasingly important as demand for data on biodiversity outstrips the financial and manpower capacity of professional scientists to supply it. Dr Geoghegan will trace the new ‘Tree Health Surveillance Framework’ for Britain, conducting empirical research with citizen scientists, plant pathologists, technicians and users of citizen data, as well as international comparative research on citizen monitoring projects in Australia, a leader in biosecurity. As well as investigating the socio-personal implications of enthusiasm, the research will offer a deeper understanding of how citizen science practices are articulated. Topics will include the use of Web 2.0 technologies, the requirements of scientists involved in studying and managing environments for health, and the relative contribution of citizen data to the resulting science. She will work in partnership with Forest Research, Sylva Foundation, and the Science Museum. Dr Geoghegan will collaborate with colleagues at the University of Washington and McGill University, as well as spend time as a Visiting Fellow at the Australian Centre for Cultural Environment Research at the University of Wollongong.   "	"81"	"Geoghegan, Hilary"	"-1"
"ES.K001043.1"	"Ecologies and Identities:a socio-legal exploration of the Marine Protected Areas network in English seas"	"http://researchcatalogue.esrc.ac.uk//grants/ES.K001043.1/read"	"2012"	"2015"	"This socio-legal project focuses on the on-going efforts to establish an ecologically coherent network of marine protected areas (MPAs) as required under the Marine and Coastal Access Act 2009 (MCCA). The network comprises MPAs of international, European and national importance, including new marine conservation zones established under the MCCA.  The project aims to capture the key social and ecological dimensions of marine conservation law at this turning point by: critically assessing the role played by marine conservation law in making the protected seascape resilient looking at the impacts of marine conservation law on the identities and roles of sea users and other stakeholders. It is hoped that the project will not only contribute to academic literature in this area but will also make meaningful policy recommendations. Methodologically, desk-based analysis of marine conservation law complements fieldwork in three case study areas in England to compare different realities. In each case study area, participant observation and semi-structured interviews will be conducted with sea users (fishermen, renewable sector and recreational groups), conservation bodies and regulators. The strategies for disseminating research findings include peer-reviewed publications and academic conferences, a website with reports written in a non-technical language and stakeholder workshops.    "	"81"	"Pieraccini, Margherita"	"-1"
"ES.J013420.1"	"Rising Powers in African agriculture: Are China and Brazil bringing new paradigms to agricultural development cooperation?"	"http://researchcatalogue.esrc.ac.uk//grants/ES.J013420.1/read"	"2012"	"2015"	"The “China and Brazil in African Agriculture” (CBAA) project will explore the new development cooperation engagements in agriculture across four African countries. The project will examine the politics of aid and investment policy in China and Brazil, exploring how understandings of agricultural development are translated in aid and investment projects. The project will be carried out through an innovative international partnership connecting researchers from institutions in the UK and Africa, already linked through the IDS-led Future Agricultures Consortium, with colleagues from China and Brazil. The research will begin with a mapping phase that will generate a geo-referenced database of Chinese and Brazilian agricultural development cooperation projects in Ethiopia, Ghana, Mozambique and Zimbabwe. This will be followed by in-depth case studies of a sample of these projects, examining the ways in which experience and expertise from China and Brazil engage with the realities of African agriculture and the perspectives of African scientists and farmers. Comparative analysis across projects, countries and types of intervention will address the question of whether a ""new paradigm"" of development cooperation is emerging, and assess the implications for the future of aid and investment policy. "	"81"	"Scoones, Ian"	"-1"
"ES.K005642.1"	"Engaging with Uncertainty and Risk in Agricultural Biotechnology Regulation: Delivering Safety and Innovation"	"http://researchcatalogue.esrc.ac.uk//grants/ES.K005642.1/read"	"2012"	"2013"	"This collaborative project between the ESRC Innogen Centre at the University of Edinburgh and Syngenta UK will build on each partner’s insights about the current operation of European regulatory and policy processes related to agricultural biotechnologies, and extend this to the future use and regulation of synthetic biology. It will apply the Innogen Centre's approaches to Adaptive Governance of Innovative Technology (AGIT) and Critical Stakeholder Engagement (CSE) to two case studies on understanding of current regulatory decisions/processes for genetically modified (GM) crops. The project will include consideration of the roles of experts and non-experts in the field, how they use evidence, and how they influence policy decisions. Innogen Centre staff have been closely involved in analysing and commenting on these areas of policy since the early 1990s when there was still considerable uncertainty about the safety of GM crops to people and the environment. The expectation at that time was that the precautionary approach would be modified if and when evidence of the safety and efficacy of GM crops became available. This project will focus on whether and how the regulatory system could become more adaptive to the latest scientific evidence on the safety and benefits of GM crops. "	"81"	"Tait, Joyce"	"-1"
"RES-062-23-1831"	"Processes of Technical Change in British Agriculture: Innovation in the Farming of South West England, 1935-1985"	"http://researchcatalogue.esrc.ac.uk//grants/RES-062-23-1831/read"	"2009"	"2013"	"As the world enters a period of growing concern over food security, it is important to learn lessons from agricultural history. The UK from the 1940s to the 1970s underwent a far reaching transformation of its farming industry. Much of the technical innovation associated with this was already available in pre-war years. Moreover, some of the cost-price pressures on agriculture that limited productivity in the 1930s were equally present post-war. Why then were there such changes in agriculture in the post-war period? Using evidence from the farm field books of the Farm Management Survey, this research will look at changes in productivity and technical innovation. This will be combined with oral history interviews with farmers, or their successors, who participated in the FMS in the 1950s and 1960s. Research Objectives: To conduct a survey of agricultural change in SW England, identifying how and when outputs changed on a sample of farms from 1935 to 1985. To use FMS fieldbooks to provide detailed information on inputs to shed light on how and when changes on individual farms were brought about. To examine through oral history interviews what motivated farmers to adopt innovations and change their farming methods?   "	"81"	"Winter, Michael"	"-1"
"RES-167-25-0510"	"Community and institutional responses to the challenges facing poor urban people in an era of global warming in Bangladesh"	"http://researchcatalogue.esrc.ac.uk//grants/RES-167-25-0510/read"	"2010"	"2014"	"Climate change and climate variability is impacting on the living conditions and livelihoods of poor people. Yet most governments in developing countries see climate change purely as a rural problem with impacts on agriculture and food security. This research seeks to fill this important knowledge gap by exploring how to effectively address the problems of poor urban people, in a context of rapid climate change. It adopts a cross-disciplinary perspective bringing together a team of leading Bangladeshi and UK researchers. The analytical framework draws on three bodies of theory: political economy of urban change assets of poor urban people adaptive practices of poor people and institutions. This research has five work packages: WP1 - inventory of challenges for the urban poor WP2 - analysis of adaptive practices WP3 - analysis of institutional structures WP4 - action research WP5 - analysis and policy findings. These involve a variety of data collection methods: participatory livelihood analysis key informant interviews dialogue with local academics, policymakers and civil society groups action research. Both qualitative and quantitative analyses of the data from our six field sites will feed into a comparative analysis, synthesis of findings and policy implications. "	"81"	"Hulme, David"	"-1"
"ES.J020567.1"	"Creating a 'Forced Labour Monitoring Group'"	"http://researchcatalogue.esrc.ac.uk//grants/ES.J020567.1/read"	"2012"	"2013"	"The ESRC ‘Follow-On’ grant entitled ‘Creating a Forced Labour Monitoring Group (FLMG)’ follows-on from two reports by the Principal Investigator (Dr Sam Scott) for the Joseph Rowntree Foundation. These looked at ‘Experiences of Forced Labour in the UK Food Industry’ and the ‘Scope of Forced Labour in the UK’ (see: http://www.jrf.org.uk/work/workarea/forced-labour). The mission statement for the FLMG is: “to help define, measure, monitor and tackle workplace abuse, exploitation and forced labour in the UK”. At present the FLMG is only a ‘pilot’ project with its exact role, remit and membership open for discussion. The 12-month grant (September 2012 - September 2013) is being coordinated by an academic steering group of: Dr Sam Scott, Dr Alex Balch, Professor Gary Craig, Dr Alistair Geddes and Dr Kendra Strauss. There are five outputs associated with the pilot project: a web-site ‘www.forcedlabour.org’ five policy workshops a book on ‘Workplace Abuse, Exploitation and Forced Labour’ academic journal articles a collaborative policy paper. These outputs are designed to act as an impetus for a longer-term FLMG that would: draw academics together with policy makers and practitioners be sustainable be independent influence policy raise knowledge and awareness of forced labour.   "	"81"	"Scott, Sam"	"-1"
"ES.K007440.1"	"Defra / EA Fellowship: Professor Frances Bowen"	"http://researchcatalogue.esrc.ac.uk//grants/ES.K007440.1/read"	"2013"	"2014"	"This project will fund a fellowship placement for Professor Frances Bowen to work for 9 months with the Better Regulation teams at the Department for Environment, Food and Rural Affairs (Defra) and the Environment Agency (EA). 'Better Regulation' is the UK government's approach to developing regulation that achieves the desired outcome while avoiding unintended consequences and limiting costs for companies, consumers and the taxpayer. For Defra and the EA, the challenge is to improve, simplify, consolidate and even remove environmental regulations, while achieving at least equivalent outcomes for the environment, society and the economy. Academic research can offer useful guidance on how to tackle this challenge through providing evidence on the impacts, costs and benefits of various approaches to environmental regulation. Professor Bowen specialises in company responses to environmental regulation, and the fellowship will allow her to share her expertise with Defra, the EA and other government departments. During the fellowship Professor Bowen will  collate research evidence on the relationships between environmental regulation, innovation, firm performance and economic growth consult these and other government agencies to develop an action plan for future research collaboration on better regulation for a sustainable economy. "	"81"	"Bowen, Frances"	"-1"
