"project__PROJECT_NUMBER"	"project__PROJECT_TITLE"	"project__source_url"	"project__PROJECT_START_DATE"	"project__PROJECT_END_DATE"	"project__PROJECT_OBJECTIVE"	"institution_data__INSTITUTION_NAME"	"institution_data__INSTITUTION_ADDRESS1"	"institution_data__INSTITUTION_CITY"	"institution_data__INSTITUTION_COUNTRY"	"institution_data__INSTITUTION_ZIP"	"investigator_data__name"	"institution_index__inst_id"	"investigator_index__inv_id"	"agency_index__aid"	"comment"
"01-RESR-105"	"Use of high pressure to improve safety and quality of shellfish"	"http://www.safefood.eu/Professional/Portfolio/1-Microbiology/Use-of-high-pressure-to-improve-safety-and-quality.aspx"	"2001"	"2004"	"The aim of this project was to study the potential for use of high pressure (HP) treatment by the seafood industry on the island of Ireland. The effect of HP treatment on inactivation of selected target indicator organisms (different strains and species of Escherichia coli and Listeria spp) and viruses in shellfish such as mussels and oysters was studied, and the impact of this process on the sensory quality and shelf-life of shellfish were assessed. Results of this project were disseminated to the seafood industry on the island of Ireland. "	"University College Cork"	""	""	""	""	"Kelly, Alan"	"-1"	"-1"	"82"	"It is likely that the Principal Contractor and awardee institution on this project do not exist in investigator data and institution data. Please follow the link http://www.safefood.eu/Professional/Portfolio/1-Microbiology/Use-of-high-pressure-to-improve-safety-and-quality.aspx to look for additional information about the investigator to be inserted into the database. The needed investigator fields are empty in this row."
"04-RESR-11"	"Temperature abuse in retail outlets"	"http://www.safefood.eu/Professional/Portfolio/1-Microbiology/Temperature-abuse-in-retail-outlets.aspx"	"2005"	"2007"	"safe food has previously conducted research on temperature abuse both in the home and in catering establishments. This project was designed to supplement this work by examining temperature abuse at retail level. Temperature abuse in conjunction with poor operational practices are the dominant factors in the mishandling of chilled food which often results in foodborne outbreaks. As the food service industry handling of perishable foods continues to grow significantly, compliance and safety of temperature-critical practices namely chill storage is essential in ensuring a safe food.The equipment scaling, maintenance and day-to-day operation are important factors to be controlled if microbial risks are to be minimised. The key areas which this project has targeted are the control and abuse of refrigeration and freezing in retail premises to include: fitness of equipment for the purpose and volume, defects in equipment and suitability of its position, maintenance and cleaning programmes, temperature monitoring, loading and stock rotation, staff responsibilities and training.The project involved a survey and risk assessment and work closely with Environment Health Officers in Northern Ireland and the Republic of Ireland. safe food funded this project collaboratively with the Food Institutional Research Measure (FIRM) programme under the Department of Agriculture and Food (DAF)."	"Dublin Institute of Technology"	""	""	""	""	", "	"-1"	"-1"	"82"	"It is likely that the Principal Contractor and awardee institution on this project do not exist in investigator data and institution data. Please follow the link http://www.safefood.eu/Professional/Portfolio/1-Microbiology/Temperature-abuse-in-retail-outlets.aspx to look for additional information about the investigator to be inserted into the database. The needed investigator fields are empty in this row."
"01-RESR-109"	"Food Safety knowledge, microbiology and refrigeration temperatures in restaurant kitchens on the island of Ireland"	"http://www.safefood.eu/Professional/Portfolio/1-Microbiology/Food-Safety-knowledge,-microbiology-and-refrig-(1).aspx"	"2005"	"2008"	"Catering establishments, such as restaurants, cafes and canteens, are a major source of food poisoning outbreaks. The aim of the project was to identify hazards associated with food handling, storage, preparation and service in commercial catering premises throughout the island of Ireland. This was achieved through a microbiological survey, an audit of 100 catering establishments, and a questionnaire survey of kitchen managers’ practices and food safety knowledge. A number of key areas where catering establishments could improve their food safety practices and overall hygiene were identified in the course of this study and appropriate remedial actions were recommended. "	"Teagasc Food Research Centre"	""	"Dublin"	""	""	"Bolton, Declan J."	"-1"	"-1"	"82"	"It is likely that the Principal Contractor and awardee institution on this project do not exist in investigator data and institution data. Please follow the link http://www.safefood.eu/Professional/Portfolio/1-Microbiology/Food-Safety-knowledge,-microbiology-and-refrig-(1).aspx to look for additional information about the investigator to be inserted into the database. The needed investigator fields are empty in this row."
"00-RESR-041"	"Assessing the effectiveness of HACCP implementation and maintenance in food production plants"	"http://www.safefood.eu/Professional/Portfolio/1-Microbiology/Assessing-the-effectiveness-of-HACCP-implementatio.aspx"	"2001"	"2002"	"The objective of this study was to assess the effectiveness with which Hazard Analysis & Critical Control Point (HACCP) has been implemented and maintained in food manufacturing plants in both Northern Ireland and the Republic of Ireland.Where inadequacies in implementation or maintenance of the HACCP system were highlighted, the study sought to identify the contributory factors and make specific recommendations to overcome these limitations. The study was unique in that it involved an in-depth, two-day evaluation of HACCP at a manufacturing site."	"Yorkshire"	""	"UK"	""	""	", "	"-1"	"-1"	"82"	"It is likely that the Principal Contractor and awardee institution on this project do not exist in investigator data and institution data. Please follow the link http://www.safefood.eu/Professional/Portfolio/1-Microbiology/Assessing-the-effectiveness-of-HACCP-implementatio.aspx to look for additional information about the investigator to be inserted into the database. The needed investigator fields are empty in this row."
"03-RESR-002"	"Epidemiology and molecular analysis of norovirus outbreaks in Ireland"	"http://www.safefood.eu/Professional/Portfolio/1-Microbiology/Epidemiology-and-molecular-analysis-of-norovirus-o.aspx"	"2004"	"2005"	"It has been increasingly recognised that noroviruses are a major cause of gastroenteritis causing large outbreaks of infectious intestinal disease in a number of settings.The overall aim of the project was to carry out surveillance of norovirus outbreaks on the island of Ireland and to link available epidemiological and molecular data on norovirus outbreaks in a common database. This data was used to review evidence for different transmission pathways e.g. person-to-person, foodborne. "	"Mater Misericordiae Hospital"	""	"Dublin"	""	""	"Kelly, Maureen Lynch and Sinead"	"-1"	"-1"	"82"	"It is likely that the Principal Contractor and awardee institution on this project do not exist in investigator data and institution data. Please follow the link http://www.safefood.eu/Professional/Portfolio/1-Microbiology/Epidemiology-and-molecular-analysis-of-norovirus-o.aspx to look for additional information about the investigator to be inserted into the database. The needed investigator fields are empty in this row."
"01–RESR–123"	"Gastrointestinal symptoms in Ireland, North and South — a survey of general practitioners"	"http://www.safefood.eu/Professional/Portfolio/1-Microbiology/Gastrointestinal-symptoms-in-Ireland,-North-and-So.aspx"	"2002"	"2003"	"This project involved an all–island survey of 1,200 general practitioners to examine the burden of gastroenteritis in general practice. It also set out to examine the attitudes towards and practices in the management and prevention of gastroenteritis, particularly relating to food- borne illness. The study also described GP’s perspectives on the surveillance and notification of particular aspects of acute gastroenteritis."	"Food Safety Authority of Ireland"	""	"Dublin"	""	""	"Fitzgerald, Margaret"	"-1"	"-1"	"82"	"It is likely that the Principal Contractor and awardee institution on this project do not exist in investigator data and institution data. Please follow the link http://www.safefood.eu/Professional/Portfolio/1-Microbiology/Gastrointestinal-symptoms-in-Ireland,-North-and-So.aspx to look for additional information about the investigator to be inserted into the database. The needed investigator fields are empty in this row."
"01-RESR-123"	"Acute Gastroenteritis in Ireland, North and South — a telephone survey"	"http://www.safefood.eu/Professional/Portfolio/1-Microbiology/Acute-Gastroenteritis-in-Ireland,-North-and-South.aspx"	"2000"	"2002"	"This project involved a telephone survey to investigate the epidemiology of self–reported gastrointestinal symptoms, in terms of incidence, duration and seasonality. The project also aimed to determine the socio–demographic profile of those who reported illness, in order to determine the characteristics and risk factors with a view to prevention and health promotion policy.This report was co-funded with Food Safety Authority of Ireland, National Disease Surveillance Centre, University College Dublin, Communicable Disease Surveillance Centre-Northern Ireland and Food Standards Agency-Northern Ireland."	"Food Safety Authority of Ireland"	""	"Dublin"	""	""	"Fitzgerald, Margaret"	"-1"	"-1"	"82"	"It is likely that the Principal Contractor and awardee institution on this project do not exist in investigator data and institution data. Please follow the link http://www.safefood.eu/Professional/Portfolio/1-Microbiology/Acute-Gastroenteritis-in-Ireland,-North-and-South.aspx to look for additional information about the investigator to be inserted into the database. The needed investigator fields are empty in this row."
"04-RESR-12"	"Development of a training pack to allow General Practitioners to develop their role in the prevention and control of food-related disease outbreaks"	"http://www.safefood.eu/Professional/Portfolio/1-Microbiology/Development-of-a-training-pack-to-allow-General-Pr.aspx"	"2005"	"2006"	"The safe food study ""Acute Gastroenteritis in Ireland, North and South - A Study of General Practitioners"" found that infectious intestinal disease is a common problem in the primary care setting accounting for almost one in every twenty consultations. A key conclusion of that survey was that there was a need to support, equip and encourage General Practitioners (GPs) to develop their role in the prevention and control of food-related disease cases and outbreaks.This project developed a training resource for GPs on the clinical management of gastroenteritis. This provides practical tools and approaches for GPs on the topic of infectious food borne illness with concise information about diagnosis, treatment and disease notification.The key aims were:"	"Royal College of General Practitioners"	""	"BelfastFionan O'Cuinneagain"	""	""	"Reilly, Philip"	"-1"	"-1"	"82"	"It is likely that the Principal Contractor and awardee institution on this project do not exist in investigator data and institution data. Please follow the link http://www.safefood.eu/Professional/Portfolio/1-Microbiology/Development-of-a-training-pack-to-allow-General-Pr.aspx to look for additional information about the investigator to be inserted into the database. The needed investigator fields are empty in this row."
"03-RESR-018"	"Economic impact of gastroenteritis in Ireland"	"http://www.safefood.eu/Professional/Portfolio/1-Microbiology/Economic-impact-of-gastroenteritis-in-Ireland.aspx"	"2004"	"2006"	"Building on the findings of the report on ""Acute Gastroenteritis in Ireland, North and South: a Telephone Survey"" , this project assessed the economic impact of gastroenteritis across the IoI taking into account the burden on individuals, families, informal carers, primary care and hospital services.This was achieved by carrying out a study in general practices to provide data to improve estimates of overall numbers of cases and patterns of different pathogens in primary care; a study of treatment and costs of treatment in primary care; a survey of families of patients with gastroenteritis to assess impact on individuals, families and informal carers; and a study of hospital treatments and associated costs for people with gastroenteritis drawn from hospital admission data."	"London School of Hygiene and Tropical Medicine"	""	""	""	""	"Roberts, Jennifer"	"-1"	"-1"	"82"	"It is likely that the Principal Contractor and awardee institution on this project do not exist in investigator data and institution data. Please follow the link http://www.safefood.eu/Professional/Portfolio/1-Microbiology/Economic-impact-of-gastroenteritis-in-Ireland.aspx to look for additional information about the investigator to be inserted into the database. The needed investigator fields are empty in this row."
"02-2008"	"Control of Campylobacter in poultry: development of a dissemination programme for lessons for farmers on the island of Ireland"	"http://www.safefood.eu/Professional/Portfolio/1-Microbiology/Control-of-Campylobacter-in-poultry-development-o.aspx"	"2008"	"2009"	"This study determined best practices for the control of Campylobacter on poultry farms, based on mining the data produced by the Northern Ireland Industrial Training and Development Unit study.This was updated and combined with published studies to produce a concise list of current best practices which was then widely disseminated in the poultry farming community across the island of Ireland in order to assist in meeting the goal of Campylobacter -free broilers. Experiences in Iceland and Belgium have shown that this would assist in the reduction of Campylobacter food poisoning in the human population. "	"Queen's University Belfast"	""	""	""	""	"Madden, Robert"	"-1"	"-1"	"82"	"It is likely that the Principal Contractor and awardee institution on this project do not exist in investigator data and institution data. Please follow the link http://www.safefood.eu/Professional/Portfolio/1-Microbiology/Control-of-Campylobacter-in-poultry-development-o.aspx to look for additional information about the investigator to be inserted into the database. The needed investigator fields are empty in this row."
"07-2008"	"Survey to determine the presence of Salmonella and Campylobacter in retail packs of raw chicken purchased throughout the Republic of Ireland"	"http://www.safefood.eu/Professional/Portfolio/1-Microbiology/Survey-to-determine-the-presence-of-Salmonella-and.aspx"	"2009"	"2010"	"This study determined the presence of Salmonella spp. and Campylobacter spp. in retail packs of raw chicken purchased throughout the Republic of Ireland. Overall 500 packs of raw chicken were purchased and analysed. The results were then compared with studies from around the world to allow their relative significance.The prevalence of Salmonella spp. and Campylobacter spp. in retail packs of raw chicken in the  Republic of Ireland  was defined. This study benchmarked the prevalence of these two major foodborne pathogens in the  Republic of Ireland . "	"Agri-Food and Biosciences Institute"	""	"Belfast"	""	""	"Madden, Robert"	"-1"	"-1"	"82"	"It is likely that the Principal Contractor and awardee institution on this project do not exist in investigator data and institution data. Please follow the link http://www.safefood.eu/Professional/Portfolio/1-Microbiology/Survey-to-determine-the-presence-of-Salmonella-and.aspx to look for additional information about the investigator to be inserted into the database. The needed investigator fields are empty in this row."
"00-RESR-086"	"A comparative study of thermophilic Campylobacter isolates of clinical and food origin using genotypic and antimicrobial characterization techniques"	"http://www.safefood.eu/Professional/Portfolio/1-Microbiology/A-comparative-study-of-thermophilic-Campylobacter.aspx"	"2001"	"2003"	"The principal objective of this project was to examine the genotypic profiles of thermophilic Campylobacter isolates recovered from retail food samples in three population centres (Dublin, Galway and Belfast) and compare them with clinical isolates obtained from human patients.This project was also extended to include an examination of the role of companion animals in the transmission of this infectious agent. "	"University College Dublin"	""	""	""	""	"Whyte, Paul"	"-1"	"-1"	"82"	"It is likely that the Principal Contractor and awardee institution on this project do not exist in investigator data and institution data. Please follow the link http://www.safefood.eu/Professional/Portfolio/1-Microbiology/A-comparative-study-of-thermophilic-Campylobacter.aspx to look for additional information about the investigator to be inserted into the database. The needed investigator fields are empty in this row."
"04-RESR-04"	"Sentinel surveillance of Campylobacter in Ireland"	"http://www.safefood.eu/Professional/Portfolio/1-Microbiology/Sentinel-surveillance-of-Campylobacter-in-Ireland.aspx"	"2005"	"2008"	"Campylobacter s are the most common bacterial cause of acute gastroenteritis in the developed world (Friedman et al. 2001). On the island of Ireland, there are approximately 2,500 confirmed cases of campylobacteriosis per year. However, the true burden of Campylobacter infections is thought to be much higher, a point of view supported by such surveys as the safe food acute gastroenteritis telephone survey in 2003. In particular, the epidemiology of Campylobacter infection is still poorly understood. This project involved the collection of detailed clinical and microbiological information on cases of Campylobacter infection in order to generate hypotheses as to potential risk factors for infection. Food, animal and human sources of Campylobacter were targeted. This project brought together Public Health Medical Practitioners, Clinical/Food Laboratory Personnel, Veterinary Health Specialists and Food Safety research expertise to address the growing issue of campylobacteriosis in Ireland. "	"Teagasc Food Research Centre"	""	"Dublin"	""	""	"Bolton, Declan"	"-1"	"-1"	"82"	"It is likely that the Principal Contractor and awardee institution on this project do not exist in investigator data and institution data. Please follow the link http://www.safefood.eu/Professional/Portfolio/1-Microbiology/Sentinel-surveillance-of-Campylobacter-in-Ireland.aspx to look for additional information about the investigator to be inserted into the database. The needed investigator fields are empty in this row."
"04-2014"	"Risk profiling Listeria in ready-to eat foods (RTE) and determination of control strategies and practical interventions"	"http://www.safefood.eu/Professional/Portfolio/1-Microbiology/Risk-profiling-Listeria-in-ready-to-eat-foods-(RTE.aspx"	"2014"	"2016"	"This project involves the risk profiling of Listeria in ready-to eat foods (RTE) and determination of control strategies and practical interventions for food processors across Northern Ireland. The study is based on an equivalent project carried out in the Republic of Ireland under the Food Institutional Research Measure (FIRM) translational research programme.The objectives of the project are:"	"Agri-Food and Biosciences Institute"	""	"Belfast"	""	""	"Madden, Robert"	"-1"	"-1"	"82"	"It is likely that the Principal Contractor and awardee institution on this project do not exist in investigator data and institution data. Please follow the link http://www.safefood.eu/Professional/Portfolio/1-Microbiology/Risk-profiling-Listeria-in-ready-to-eat-foods-(RTE.aspx to look for additional information about the investigator to be inserted into the database. The needed investigator fields are empty in this row."
"11-2008"	"A survey of retail cold sliced meats with particular reference to the presence of Listeria monocytogenes and Clostridium botulinum toxin, to include reduced-salt and reduced-fat products"	"http://www.safefood.eu/Professional/Portfolio/1-Microbiology/A-survey-of-retail-cold-sliced-meats-with-particul.aspx"	"2008"	"2010"	"This survey provided valid and reliable data on the numbers and range of the complete list of foodborne indicator organisms from ready-to-eat cold cooked sliced meats sold at retail throughout the Republic of Ireland. In addition, information on the incidence of Clostridium botulinum toxin in such products was provided, as was data on the chemical composition and water activity of the products tested.The extent and range of products tested, together with the breadth of analyses undertaken, identified the extent to which such products contribute to the foodborne infections and illnesses in the Republic of Ireland.This data complements similar surveys carried out in recent years in Great Britain, where the incidence of listeriosis has increased in recent years. "	"Agri-Food and Biosciences Institute"	""	"Belfast"	""	""	"Madden, Robert"	"-1"	"-1"	"82"	"It is likely that the Principal Contractor and awardee institution on this project do not exist in investigator data and institution data. Please follow the link http://www.safefood.eu/Professional/Portfolio/1-Microbiology/A-survey-of-retail-cold-sliced-meats-with-particul.aspx to look for additional information about the investigator to be inserted into the database. The needed investigator fields are empty in this row."
"06-RESR-02"	"Survey of retail smoked fish with particular reference to the presence of Listeria monocytogenes"	"http://www.safefood.eu/Professional/Portfolio/1-Microbiology/Survey-of-retail-smoked-fish-with-particular-refer.aspx"	"2006"	"2007"	"This study examined ready to eat (RTE) retail smoked fish with particular reference to Listeria monocytogenes . Samples of RTE hot and cold smoked fish were purchased from retail outlets throughout the Republic of Ireland and analysed.Overall contamination by Listeria spp. was 10.2% (all at acceptable levels). The pathogen was detected in 4.7% of samples at <10 cfu/g. Of the 105 samples of cold smoked fish tested, 19 (18.1%) contained Listeria ; nine of which were Listeria monocytogenes . Of the 151 samples of hot smoked fish tested seven contained Listeria ; two of which were Listeria monocytogenes .The survey revealed that salmon was the most common fish contaminated with Listeria spp. with 22 positive isolations; 10 of which were L. monocytogenes . Mackerel was less frequently contaminated with three positive Listeria isolations; two of which were L. monocytogenes . Trout showed the lowest prevalence of contamination for Listeria spp. Neither Salmonella nor E. coli were detected in any sample while nine samples contained Staphylococcus aureus . Enterobacteriaceae were detected in just two of the 256 samples taken. "	"Food Safety Assurance"	""	"UK"	""	""	"Banks, Jeff"	"-1"	"-1"	"82"	"It is likely that the Principal Contractor and awardee institution on this project do not exist in investigator data and institution data. Please follow the link http://www.safefood.eu/Professional/Portfolio/1-Microbiology/Survey-of-retail-smoked-fish-with-particular-refer.aspx to look for additional information about the investigator to be inserted into the database. The needed investigator fields are empty in this row."
"Synergy project"	"Establishment of the prevalence of Listeria monocytogenes in both specified food samples and faecal samples, and to type all isolates for the purpose of comparing similarity between the strains isolated"	"http://www.safefood.eu/Professional/Portfolio/1-Microbiology/Establishment-of-the-prevalence-of-Listeria-monocy.aspx"	"2005"	"2005"	"There is a scarcity of data on the incidence of Listeria monocytogenes in butter spreads and in fresh, soft and semi–hard cheeses. There have been a number of large outbreaks, mainly in North America, where Listeria monocytogenes was identified as the causative agent.The aim of this project was to establish the prevalence of Listeria monocytogenes in dairy products, including butter, cheese and pates purchased from retail outlets in the Waterford area. The project compared strains found in food with those of clinical isolates and allowed for the establishment of a bank of isolates for use in further research. "	"Waterford Regional Hospital"	""	""	""	""	"Shanaghy, Noel"	"-1"	"-1"	"82"	"It is likely that the Principal Contractor and awardee institution on this project do not exist in investigator data and institution data. Please follow the link http://www.safefood.eu/Professional/Portfolio/1-Microbiology/Establishment-of-the-prevalence-of-Listeria-monocy.aspx to look for additional information about the investigator to be inserted into the database. The needed investigator fields are empty in this row."
