"project__PROJECT_NUMBER"	"project__PROJECT_TITLE"	"project__source_url"	"project__PROJECT_START_DATE"	"project__PROJECT_END_DATE"	"project__PROJECT_OBJECTIVE"	"institution_data__INSTITUTION_NAME"	"institution_data__INSTITUTION_ADDRESS1"	"institution_data__INSTITUTION_CITY"	"institution_data__INSTITUTION_COUNTRY"	"institution_data__INSTITUTION_ZIP"	"investigator_data__name"	"institution_index__inst_id"	"investigator_index__inv_id"	"agency_index__aid"	"comment"
"Synergy project"	"The quantification of genetically modified (GM) soya and maize in selected foods and authentication of meat in meat products using Real Time PCR techniques: an inter–laboratory collaborative study"	"http://www.safefood.eu/Professional/Portfolio/3-Chemistry-Toxicology/The-quantification-of-genetically-modified-(GM)-so.aspx"	"2003"	"2004"	"The aim of this inter–laboratory study was to determine the level of GM soya and maize in certain foods sampled across the island of Ireland. It also aimed to determine the extent of substitution or contamination of meat products by inferior meat species in contravention of European food labelling legislation and in the interest of addressing food safety and public health concerns.It was a unique opportunity to establish a fully equipped DNA food testing laboratory capacity and to encourage inter–laboratory cooperation in a rapidly developing analytical area. Food samples were taken from three different sites in the Republic of Ireland and in Northern Ireland, and included soya, maize and meat products."	"Cork Public Analyst's Laboratory"	""	""	""	""	"Davidson, Fred"	"-1"	"-1"	"82"	"It is likely that the Principal Contractor and awardee institution on this project do not exist in investigator data and institution data. Please follow the link http://www.safefood.eu/Professional/Portfolio/3-Chemistry-Toxicology/The-quantification-of-genetically-modified-(GM)-so.aspx to look for additional information about the investigator to be inserted into the database. The needed investigator fields are empty in this row."
"Synergy project"	"The introduction and set-up of the biodetection systems DR-CALUX cell culture assay for the detection of dioxins in food"	"http://www.safefood.eu/Professional/Portfolio/3-Chemistry-Toxicology/The-introduction-and-set-up-of-the-biodetection-sy.aspx"	"2002"	"2004"	"The DR-CALUX assay uses genetically modified animal cells to detect, specifically and quantitatively, toxicity caused by exposure to dioxin and dioxin-like PCBs in a wide range of matrices, including food.This assay detects dioxins based on their specific biological activity towards genetically modified living cells through light generation from the recombinant cells. The project focussed primarily on method development."	"Galway Public Analyst's Laboratory"	""	"Galway"	""	""	"Canavan, Peadar"	"-1"	"-1"	"82"	"It is likely that the Principal Contractor and awardee institution on this project do not exist in investigator data and institution data. Please follow the link http://www.safefood.eu/Professional/Portfolio/3-Chemistry-Toxicology/The-introduction-and-set-up-of-the-biodetection-sy.aspx to look for additional information about the investigator to be inserted into the database. The needed investigator fields are empty in this row."
"02-PG-027"	"Food and a primary link to human cancer: developing techniques to measure a potent carcinogen present in cooked foods"	"http://www.safefood.eu/Professional/Portfolio/3-Chemistry-Toxicology/Food-and-a-primary-link-to-human-cancer-developin.aspx"	"2002"	"2006"	"One of the research recommendations that emerged from the World Health Organisation (WHO)/Food and Agriculture Organisation (FAO) Acrylamide in Food Network was the need to develop simple low-cost method(s) to be used for routine monitoring. safe food sponsored a research project to design rapid and accurate tests for this carcinogenic compound. Two antibody based tests – ELISA and biosensor immunoassays – were produced and were shown to give rapid, quantitative and reproducible results for large numbers of food samples and across a wide range of food matrices.In addition, these methods were shown to detect adducted acrylamide in human blood samples. Rapid sample preparation permits the analysis of a greater number of samples per day than would be possible with an equivalent LC/MS-MS system. Both ELISA and biosensor immunoassays for the detection of acrylamide in food were the first of their kind."	"Queen's University Belfast"	""	""	""	""	"Elliott, Chris"	"-1"	"-1"	"82"	"It is likely that the Principal Contractor and awardee institution on this project do not exist in investigator data and institution data. Please follow the link http://www.safefood.eu/Professional/Portfolio/3-Chemistry-Toxicology/Food-and-a-primary-link-to-human-cancer-developin.aspx to look for additional information about the investigator to be inserted into the database. The needed investigator fields are empty in this row."
"05-2010B"	"A meat speciation survey of selected meat products at retail level"	"http://www.safefood.eu/Professional/Portfolio/3-Chemistry-Toxicology/A-meat-speciation-survey-of-selected-meat-products.aspx"	"2010"	"2011"	"Regulatory food authorities strive to promote honest and informative labelling to help consumers make informed choices. This aspiration must be substantiated by activities to check whether food is mis-described. EU legislation requires meat to be labelled with the animal species from which it comes, and to quantify the meat ingredients. Mechanically recovered meat falls outside this definition and cannot count towards the meat content. Similarly, other parts of the carcass such as heart, liver, kidney, etc., must also be labelled separately, and the generic term ""offal"" is not permitted. Therefore, in order to check compliance with these labelling requirements, analytical DNA-based techniques are available to detect and quantify meat species and other meat ingredients in meat products. A number of species-specific methods have been developed for the detection of beef, lamb, pork, chicken and turkey.The purpose of this project was to enhance the capacity of the Public Analyst system on the island of Ireland by facilitating the implementation of methods that could then be used to determine the authenticity of processed meat products. Method development concentrated on chicken burgers and sausages (cheaper brands). The project was part of an ongoing collaboration between safe food and the Public Analyst Laboratories and in this instance involved the Cork Public Analyst Laboratory which has been designated the National Reference Laboratory for meat speciation by the Dept. of Health & Children. In conjunction with the project, Cork PAL personnel availed of the Training and Mobility Programme travel grant scheme of the safe food Knowledge Networks to attend the JRC Joint Research Centre, Molecular Biology and Genomics Unit in Warsaw."	"Cork Public Analyst Laboratory"	""	""	""	""	"Davison, Fred"	"-1"	"-1"	"82"	"It is likely that the Principal Contractor and awardee institution on this project do not exist in investigator data and institution data. Please follow the link http://www.safefood.eu/Professional/Portfolio/3-Chemistry-Toxicology/A-meat-speciation-survey-of-selected-meat-products.aspx to look for additional information about the investigator to be inserted into the database. The needed investigator fields are empty in this row."
"Synergy project"	"The Introduction and set-up of a High Performance Liquid Chromatography (HPLC) system for the detection & determination of preservatives, sweeteners, artificial colours & other additives and contaminants in specified foods"	"http://www.safefood.eu/Professional/Portfolio/3-Chemistry-Toxicology/The-Introduction-and-set-up-of-a-High-Performance.aspx"	"2001"	"2003"	"The DR-CALUX assay uses genetically modified animal cells to detect, specifically and quantitatively, toxicity caused by exposure to dioxin and dioxin-like PCBs in a wide range of matrices, including food. This assay detects dioxins based on their specific biological activity towards genetically modified living cells through light generation from the recombinant cells.  The project focussed primarily on method development."	"Public Analyst's Laboratory"	""	"Northern Ireland"	""	""	"Walker, Michael"	"-1"	"-1"	"82"	"It is likely that the Principal Contractor and awardee institution on this project do not exist in investigator data and institution data. Please follow the link http://www.safefood.eu/Professional/Portfolio/3-Chemistry-Toxicology/The-Introduction-and-set-up-of-a-High-Performance.aspx to look for additional information about the investigator to be inserted into the database. The needed investigator fields are empty in this row."
"01-2010"	"The cost of overweight and obesity on the island of Ireland"	"http://www.safefood.eu/Professional/Portfolio/4-Nutrition-and-Healthy-Eating/The-cost-of-overweight-and-obesity-on-the-island-o.aspx"	"2011"	"2012"	"This study provided a comprehensive assessment of the cost of overweight and obesity on the island of Ireland. Costs was measured from the perspective of public and private funded health services in relation to health and social costs and also examined costs associated with time lost at work due to ill health associated with overweight and obesity. A thorough review of the existing international literature on the costs of overweight and obesity was carried out, as were the methods used. "	"University College Cork"	""	""	""	""	"Perry, Ivan"	"-1"	"-1"	"82"	"It is likely that the Principal Contractor and awardee institution on this project do not exist in investigator data and institution data. Please follow the link http://www.safefood.eu/Professional/Portfolio/4-Nutrition-and-Healthy-Eating/The-cost-of-overweight-and-obesity-on-the-island-o.aspx to look for additional information about the investigator to be inserted into the database. The needed investigator fields are empty in this row."
"07-2010"	"Consumer understanding of food portion sizes"	"http://www.safefood.eu/Professional/Portfolio/4-Nutrition-and-Healthy-Eating/Consumer-understanding-of-food-portion-sizes.aspx"	"2010"	"2013"	"This project aims to address the call for urgent and concerted action on the part of health professionals, industry, government departments, workplaces, schools and the general public on the escalating rates of obesity on the island of Ireland - if the problem is to be attenuated and reversed.However, given that established obesity is largely immutable to remedial action, there is an urgent need to focus attention on those environmental factors, including portion size, that are amenable to preventive action. Simply educating consumers about what foods to eat, or not to eat is clearly not enough; an equally important challenge is to get consumers to appreciate the importance of and act on the quantity of food being consumed. Currently, however, on the island there is a paucity of data on consumer understanding and behaviour around portion size, a gap which needs to be addressed in order to initiate clear and meaningful practical advice about portion sizes that will resonate with consumers."	"University of Ulster"	""	"Coleraine"	""	""	"Livingstone, Barbara"	"-1"	"-1"	"82"	"It is likely that the Principal Contractor and awardee institution on this project do not exist in investigator data and institution data. Please follow the link http://www.safefood.eu/Professional/Portfolio/4-Nutrition-and-Healthy-Eating/Consumer-understanding-of-food-portion-sizes.aspx to look for additional information about the investigator to be inserted into the database. The needed investigator fields are empty in this row."
"16-2009"	"Good days and bad days: an investigation of the habits of shoppers when they do or don't buy healthy foods"	"http://www.safefood.eu/Professional/Portfolio/4-Nutrition-and-Healthy-Eating/Good-days-and-bad-days-an-investigation-of-the-ha.aspx"	"2010"	"2011"	"This project undertook a comprehensive programme of research to better understand the habits of shoppers and to determine when they do and don’t buy healthy foods. The research provided an understanding of the reasoning behind consumers’ food choices and explored the role of shopping practices that both promote and impede shopping behaviours that lead to healthy choices.The research:"	"Queen's University Belfast"	""	""	""	""	"Dean, Moira"	"-1"	"-1"	"82"	"It is likely that the Principal Contractor and awardee institution on this project do not exist in investigator data and institution data. Please follow the link http://www.safefood.eu/Professional/Portfolio/4-Nutrition-and-Healthy-Eating/Good-days-and-bad-days-an-investigation-of-the-ha.aspx to look for additional information about the investigator to be inserted into the database. The needed investigator fields are empty in this row."
"03-2008"	"Children and adolescents drinks consumption"	"http://www.safefood.eu/Professional/Portfolio/4-Nutrition-and-Healthy-Eating/Children-and-adolescents-drinks-consumption.aspx"	"2008"	"2008"	"The main objective of this research was to identify knowledge and practice in relation to drinks for children and young people aged 12-18 years within the context of their everyday lives.This research:"	"Dublin"	""	""	""	""	"Brown, Millward"	"-1"	"-1"	"82"	"It is likely that the Principal Contractor and awardee institution on this project do not exist in investigator data and institution data. Please follow the link http://www.safefood.eu/Professional/Portfolio/4-Nutrition-and-Healthy-Eating/Children-and-adolescents-drinks-consumption.aspx to look for additional information about the investigator to be inserted into the database. The needed investigator fields are empty in this row."
"02-2007"	"A Cross-Sectional study of an Irish population estimating dietary salt intake, and its association with other lifestyle related risk factors"	"http://www.safefood.eu/Professional/Portfolio/4-Nutrition-and-Healthy-Eating/A-Cross-Sectional-study-of-an-Irish-population-est.aspx"	"2007"	"2009"	"The Irish population consume a high salt diet. Chronic high salt intake is associated with hypertension and other adverse life style factors like obesity and lack of physical exercise. A description of salt intake in the population can be performed by measuring urinary excretion of salt while additional useful information can be acquired using a detailed food questionnaire.The study sampled two distinct groups of healthy individuals to ensure representation of all age groups within the adult population. The first population was based on a group of subjects of 45 years and older. These subjects are at a higher risk of cardiovascular disease. In this population the study described both the level of salt intake and also the distribution of hypertension and other risk factors in this population such as lipid profile, smoking, physical exertion and glucose intolerance. These subjects used a cluster method of sampling based on the SLAN 06 sampling methods. A detailed local study in UCC included younger subjects.  This measured dietary intake of salt in younger subjects. Core measurement of 24 hour excretion of sodium was made in 700 individuals and 1,600 spot urine samples were analysed."	"University College Cork"	""	""	""	""	"Perry, Ivan"	"-1"	"-1"	"82"	"It is likely that the Principal Contractor and awardee institution on this project do not exist in investigator data and institution data. Please follow the link http://www.safefood.eu/Professional/Portfolio/4-Nutrition-and-Healthy-Eating/A-Cross-Sectional-study-of-an-Irish-population-est.aspx to look for additional information about the investigator to be inserted into the database. The needed investigator fields are empty in this row."
"04-PG-20"	"Longitudinal study of changes in body mass index (BMI), anthropometric measures, dietary intake and physical activity in cohorts of school going adolescents in both Junior and post-Junior cycles"	"http://www.safefood.eu/Professional/Portfolio/4-Nutrition-and-Healthy-Eating/Longitudinal-study-of-changes-in-body-mass-index-(.aspx"	"2004"	"2007"	"Worldwide, the prevalence of childhood obesity is increasing. Obesity in adolescence is a strong predicator of adult obesity. This project involved a longitudinal study over a 3-year period of changes in Body Mass Index (BMI) and other anthropometric measures together with information on dietary and exercise patterns in a cohort of students in the junior school cycle.A similar longitudinal survey was conducted in a second cohort of students in the post-junior cycle. This generated new data on the adolescent age group 12-18 yrs. This data is important in understanding the evolution during adolescence of changes in anthropometric measures and dietary and exercise patterns, which tend to be maintained into adulthood where they have a major impact on chronic disease. "	"University College Cork"	""	""	""	""	"O'Connor, Nora O'Brien & Tom"	"-1"	"-1"	"82"	"It is likely that the Principal Contractor and awardee institution on this project do not exist in investigator data and institution data. Please follow the link http://www.safefood.eu/Professional/Portfolio/4-Nutrition-and-Healthy-Eating/Longitudinal-study-of-changes-in-body-mass-index-(.aspx to look for additional information about the investigator to be inserted into the database. The needed investigator fields are empty in this row."
"03-RESR-017"	"A systematic review of the effectiveness of social marketing models in communicating nutrition and food safety messages"	"http://www.safefood.eu/Professional/Portfolio/4-Nutrition-and-Healthy-Eating/A-systematic-review-of-the-effectiveness-of-social.aspx"	"2003"	"2004"	"A rigorous s ystematic review of the literature in relation to models of social marketing was carried out, examining both national and international research and critically evaluating best models for communication of nutrition and food safety messages.The key objectives of this project were to identify the most effective methods in terms of positive impact on knowledge, perception and behaviour, and to make recommendations for further research based on the material reviewed."	"University of Stirling"	""	""	""	""	"Hastings, Gerard"	"-1"	"-1"	"82"	"It is likely that the Principal Contractor and awardee institution on this project do not exist in investigator data and institution data. Please follow the link http://www.safefood.eu/Professional/Portfolio/4-Nutrition-and-Healthy-Eating/A-systematic-review-of-the-effectiveness-of-social.aspx to look for additional information about the investigator to be inserted into the database. The needed investigator fields are empty in this row."
"01-RESR-001"	"Dietary strategies for achievement of nutritional goals for healthy eating: towards evidence based public health nutrition programmes"	"http://www.safefood.eu/Professional/Portfolio/4-Nutrition-and-Healthy-Eating/Dietary-strategies-for-achievement-of-nutritional.aspx"	"2001"	"2003"	"The principal objective of this research was to identify dietary strategies for achievement of key nutritional goals by population groups, which are considered important to public health: energy balance, overweight, and obesity, intakes of total fat and fatty acids, intakes of fruits, vegetables, fibre and carbohydrates."	"University College Cork"	""	""	""	""	"Flynn, Albert"	"-1"	"-1"	"82"	"It is likely that the Principal Contractor and awardee institution on this project do not exist in investigator data and institution data. Please follow the link http://www.safefood.eu/Professional/Portfolio/4-Nutrition-and-Healthy-Eating/Dietary-strategies-for-achievement-of-nutritional.aspx to look for additional information about the investigator to be inserted into the database. The needed investigator fields are empty in this row."
"04-2009"	"Salt levels in ready-to-eat soup purchased in catering establishments"	"http://www.safefood.eu/Professional/Portfolio/4-Nutrition-and-Healthy-Eating/Salt-levels-in-ready-to-eat-soup-purchased-in-cate.aspx"	"2010"	"2011"	"The aim of this survey was to provide a snap shot of the salt content of soup from a range of catering outlets on the island. The survey set out to investigate any differences in the salt content of soups that claim to be ""homemade/freshly prepared"" versus other types of soups sold in catering outlets.The results will be used to communicate salt reduction messages to consumers and the food industry. "	"Eolas International Research Ltd., Co."	""	"Cork"	""	""	"Kirwan, Fidelma"	"-1"	"-1"	"82"	"It is likely that the Principal Contractor and awardee institution on this project do not exist in investigator data and institution data. Please follow the link http://www.safefood.eu/Professional/Portfolio/4-Nutrition-and-Healthy-Eating/Salt-levels-in-ready-to-eat-soup-purchased-in-cate.aspx to look for additional information about the investigator to be inserted into the database. The needed investigator fields are empty in this row."
"10-2009"	"Family eating out events ""outside of the home"""	"http://www.safefood.eu/Professional/Portfolio/4-Nutrition-and-Healthy-Eating/Family-eating-out-events-outside-of-the-home.aspx"	"2010"	"2012"	"This project aimed to carry out a full review of literature, fully referenced, and any other relevant sources to ascertain best practice in providing healthy and nutritious food for children within the catering sector. A quantitative survey to investigate the range of children’s meals available in different types of catering outlets in the Republic of Ireland and Northern Ireland was carried out by conducting an on-site survey.The catering outlets included dispersion between rural and urban setting, high end and less expensive offerings, local independents and international chains. Attitudes and experiences of parents and guardians of children aged 5 – 12 years were investigated when faced with the menu options available when eating outside the family home. Key areas of investigation included concerns about nutrition, key motivators in final meal selection, and where ultimate responsibility for choice of menu lies – i.e. parent or child. An investigation into the attitudes of children aged 5 – 12 years old on food and eating occasions outside the family home was also carried out.This was conducted through a series of friendship pairs, restricted to tightly controlled age bands across both Northern Ireland and the Republic of Ireland, with the objective of understanding how children perceive eating out, and whether nutrition or healthy content is part of the consideration set."	"University of Ulster"	""	"Coleraine"	""	""	"Livingstone, Barbara"	"-1"	"-1"	"82"	"It is likely that the Principal Contractor and awardee institution on this project do not exist in investigator data and institution data. Please follow the link http://www.safefood.eu/Professional/Portfolio/4-Nutrition-and-Healthy-Eating/Family-eating-out-events-outside-of-the-home.aspx to look for additional information about the investigator to be inserted into the database. The needed investigator fields are empty in this row."
"03-CHR-01"	"Hit on Health: a healthy food initiative in takeaway/fast-food outlets"	"http://www.safefood.eu/Professional/Portfolio/4-Nutrition-and-Healthy-Eating/Hit-on-Health-a-healthy-food-initiative-in-takeaw.aspx"	"2003"	"2004"	"Food sold in fast-food outlets tends to be energy-dense and often low in other nutrients such as vitamins and minerals. This is of concern as studies have shown that a high fat, energy-dense diet and sedentary lifestyle are strongly associated with the increased risk of obesity.Building on the ""Happy Heart"" catering award, which was active within two health boards in the Republic of Ireland, this project endeavoured to educate and promote healthy food and healthy eating within the fast food industry. It provided an opportunity for consumers to make healthy choices, and also provided education and positive publicity for the retailer."	"HSE-Midlands"	""	""	""	""	"Purtill, Elmary"	"-1"	"-1"	"82"	"It is likely that the Principal Contractor and awardee institution on this project do not exist in investigator data and institution data. Please follow the link http://www.safefood.eu/Professional/Portfolio/4-Nutrition-and-Healthy-Eating/Hit-on-Health-a-healthy-food-initiative-in-takeaw.aspx to look for additional information about the investigator to be inserted into the database. The needed investigator fields are empty in this row."
