"project__PROJECT_NUMBER"	"project__PROJECT_TITLE"	"project__source_url"	"project__PROJECT_START_DATE"	"project__PROJECT_END_DATE"	"project__PROJECT_OBJECTIVE"	"institution_data__INSTITUTION_NAME"	"institution_data__INSTITUTION_ADDRESS1"	"institution_data__INSTITUTION_CITY"	"institution_data__INSTITUTION_COUNTRY"	"institution_data__INSTITUTION_ZIP"	"investigator_data__name"	"institution_index__inst_id"	"investigator_index__inv_id"	"agency_index__aid"	"comment"
"03-PG-09"	"Genetic analysis of resistance to detergents and industrial cleaning solutions in Listeria monocytogenes growing as planktonic cells and biofilms"	"http://www.safefood.eu/Professional/Portfolio/1-Microbiology/Genetic-analysis-of-resistance-to-detergents-and-i.aspx"	"2003"	"2006"	"Investigation of several outbreaks of listeriosis worldwide has indicated that contamination of foods with this pathogen appears to have occurred from a persistent source of the pathogen in the food manufacturing plant that survived industrial cleaning protocols.The objective of this project was to identify genes involved in the resistance of planktonic Listeria monocytogenes cells to detergents and industrial cleaning agents. Mutants exhibiting reduced detergent resistance were subsequently analysed for detergent resistance in biofilms. In addition the correlation between detergent and bile resistance were investigated to test the hypothesis that industrial detergents may select for bile resistant strains of L. monocytogenes in the food-processing environment. "	"University College Cork"	""	""	""	""	"Gahan, Cormac"	"-1"	"-1"	"82"	"It is likely that the Principal Contractor and awardee institution on this project do not exist in investigator data and institution data. Please follow the link http://www.safefood.eu/Professional/Portfolio/1-Microbiology/Genetic-analysis-of-resistance-to-detergents-and-i.aspx to look for additional information about the investigator to be inserted into the database. The needed investigator fields are empty in this row."
"02-PG-031"	"Listeria monocytogenes in low pH foods: an examination of the influence of food constituents on survival and gastric transit"	"http://www.safefood.eu/Professional/Portfolio/1-Microbiology/Listeria-monocytogenes-in-low-pH-foods-an-examina.aspx"	"2002"	"2006"	"The ability to tolerate highly acidic environments enhances the potential for growth of Listeria monocytogenes in low pH foods and permits survival during gastric transit. One mechanism that the bacterium uses to survive under such conditions is the arginine deiminase system.During the course of this project, the extent to which arginine and other food constituents play a role in the survival of Listeria monocytogenes in low pH foods was examined, and the role of these protective systems in determining the infectious dose of this important foodborne pathogen was investigated. "	"University College Cork"	""	""	""	""	"Hill, Colin"	"-1"	"-1"	"82"	"It is likely that the Principal Contractor and awardee institution on this project do not exist in investigator data and institution data. Please follow the link http://www.safefood.eu/Professional/Portfolio/1-Microbiology/Listeria-monocytogenes-in-low-pH-foods-an-examina.aspx to look for additional information about the investigator to be inserted into the database. The needed investigator fields are empty in this row."
"03-RESR-005"	"Development of a risk assessment model for Salmonella in shell eggs and processed eggs in Ireland"	"http://www.safefood.eu/Professional/Portfolio/1-Microbiology/Development-of-a-risk-assessment-model-for-Salmone.aspx"	"2005"	"2008"	"Hens' eggs are the principal source of Salmonella Enteritidis . This project investigated the effect of vaccination of layers and application of Quality Assurance (QA) schemes on the risk of human infection with Salmonella spp. from the consumption of eggs and processed liquid egg produced on the island of Ireland. An extensive survey of shell eggs and processed liquid eggs was undertaken to provide data on the prevalence of Salmonella spp. in eggs on the island. Data from this survey was used to develop two quantitative Microbiological Risk Assessments (MRAs), one for Northern Ireland and the other for the Republic of Ireland."	"Agri-Food and Biosciences Institute"	""	"Belfast"	""	""	"Madden, David McCleery & Robert"	"-1"	"-1"	"82"	"It is likely that the Principal Contractor and awardee institution on this project do not exist in investigator data and institution data. Please follow the link http://www.safefood.eu/Professional/Portfolio/1-Microbiology/Development-of-a-risk-assessment-model-for-Salmone.aspx to look for additional information about the investigator to be inserted into the database. The needed investigator fields are empty in this row."
"04-RESR-08"	"Occurrence of Salmonella on pork on the island of Ireland and an assessment of the risk factors contributing to its transmission"	"http://www.safefood.eu/Professional/Portfolio/1-Microbiology/Occurrence-of-Salmonella-on-pork-on-the-island-of.aspx"	"2005"	"2008"	"Salmonella species have been consistently associated with food borne illness and are the second most common cause of bacterial food borne illness. Pork has now taken over from eggs as one of the most important food borne sources of Salmonella . Outbreaks of S. Typhimurium DT104 in Dublin in 1998 and the West of Ireland in 2000 which were linked to cooked ham resulted in 78 people and 140 people becoming ill respectively.In the Republic of Ireland and Northern Ireland, two different approaches are taken to control Salmonella in pigs. In the Republic of Ireland, every pig herd is tested on the farm on a quarterly basis to establish its Salmonella status. The category status assigned determines the treatment at slaughter and affects the need for further treatment or the destination of the meat. In  Northern Ireland , there is no statutory requirement for Salmonella testing in pork. There is a voluntary system in place which tests juice from meat samples for Salmonella antibodies as they go through the abattoir. Results are compared to the national average and specialist advice is given to farms producing pigs which display high levels of contamination.The overall aim of this project was to assess the effectiveness of current control programmes and the public health risk and economic cost attributable to Salmonella on pork on the island of Ireland. This project aimed to draw together and build on existing work in this area and carried out a risk assessment of the product pathway from farm to retail level. The research has provided the basis for key decisions on changes to the Regulatory Salmonella control programmes for pigs by the Department of Agriculture, Fisheries and Food in the Republic of Ireland. The research and developed risk model are also being fed into a European Quantitative Risk Assessment for Salmonella in pigs being developed by the European Food Safety Authority (EFSA)."	"Teagasc Food Research Centre"	""	"Dublin"	""	""	"Duffy, Geraldine"	"-1"	"-1"	"82"	"It is likely that the Principal Contractor and awardee institution on this project do not exist in investigator data and institution data. Please follow the link http://www.safefood.eu/Professional/Portfolio/1-Microbiology/Occurrence-of-Salmonella-on-pork-on-the-island-of.aspx to look for additional information about the investigator to be inserted into the database. The needed investigator fields are empty in this row."
"01-2014"	"Emerging issues: an analysis for Verocytotoxigenic Escherichia coli on the island of Ireland"	"http://www.safefood.eu/Professional/Portfolio/1-Microbiology/Emerging-issues-an-analysis-for-Verocytotoxigenic.aspx"	"2014"	"2015"	"This project will assess the capacity for the detection and characterisation of VTEC E.coli (incl. O157 and non-O157 serogroups) on the  island of Ireland , and will assist in identifying any gaps in the current arrangements as well as examining international best practice in this area. The aim of this study is to conduct desk research to examine the current procedures and capacity for the detection of VTEC in food, animal and human clinical samples on the  island of Ireland , and to investigate best practice in this area.The objectives of the project are:"	"Cork Institute of Technology"	""	""	""	""	"Lucey, Brigid"	"-1"	"-1"	"82"	"It is likely that the Principal Contractor and awardee institution on this project do not exist in investigator data and institution data. Please follow the link http://www.safefood.eu/Professional/Portfolio/1-Microbiology/Emerging-issues-an-analysis-for-Verocytotoxigenic.aspx to look for additional information about the investigator to be inserted into the database. The needed investigator fields are empty in this row."
"08-2013"	"Assessment of antibiotic resistant Escherichia coli in meat production systems on the island of Ireland"	"http://www.safefood.eu/Professional/Portfolio/1-Microbiology/Assessment-of-antibiotic-resistant-Escherichia-col.aspx"	"2013"	"2014"	"This project will assess the pathogenic potential of antibiotic resistant Escherichia coli (AREC), particularly those producing Extended Spectrum ? Lactamase (ESBL), in foods derived from animal production systems and to define the potential risks posed by these organisms to the consumer on the island of Ireland.The study will conduct a thorough definition of the phenotypic and genotypic properties of positive isolates, allowing the similarities of the isolates to be statistically defined. Based on these properties, the risk due to the pathogenic potential of ESBL-producing bacteria in the food chain for consumers on the island will be defined.The possible origins and dispersal mechanisms of the AREC will be considered and possible prophylactic measures proposed to limit exposure by consumers to ESBL-producing bacteria. "	"Agri-Food and Biosciences Institute"	""	"Belfast"	""	""	"Madden, Robert"	"-1"	"-1"	"82"	"It is likely that the Principal Contractor and awardee institution on this project do not exist in investigator data and institution data. Please follow the link http://www.safefood.eu/Professional/Portfolio/1-Microbiology/Assessment-of-antibiotic-resistant-Escherichia-col.aspx to look for additional information about the investigator to be inserted into the database. The needed investigator fields are empty in this row."
"04-RESR-013"	"Surveillance of dairy herds for emerging pathogens - Salmonella, Campylobacter, Listeria, Enterobacteriaceae, Staphylococcus aureus and Mycobacterium avium subsp. Paratuberculosis (MAP)"	"http://www.safefood.eu/Professional/Portfolio/1-Microbiology/Surveillance-of-dairy-herds-for-emerging-pathogens.aspx"	"2005"	"2006"	"This project involved surveillance and monitoring of milk production holdings (bovine, ovine and caprine) supplying milk for farmhouse cheese production. The monitoring programme was carried out during a number of seasonal cycles in order to establish baseline data on the prevalence and characteristics of the following key pathogens; Salmonella, Campylobacter, Listeria, Enterobacteriaceae, Staphylococcus aureus and Mycobacterium Avium paratuberculosis .The information generated has provided key information which can be applied for risk assessment and epidemiological investigations in particular with regard to the food safety risks associated with unpasteurised dairy products. safe food funded this project collaboratively with the Food Safety Authority of Ireland. "	"Cork County Council"	""	""	""	""	", "	"-1"	"-1"	"82"	"It is likely that the Principal Contractor and awardee institution on this project do not exist in investigator data and institution data. Please follow the link http://www.safefood.eu/Professional/Portfolio/1-Microbiology/Surveillance-of-dairy-herds-for-emerging-pathogens.aspx to look for additional information about the investigator to be inserted into the database. The needed investigator fields are empty in this row."
"04-PG-17"	"Arcobacter spp. in retail foodstuffs in Ireland: optimising isolation procedures and an investigation of their genetic relatedness"	"http://www.safefood.eu/Professional/Portfolio/1-Microbiology/Arcobacter-spp-in-retail-foodstuffs-in-Ireland-o.aspx"	"2004"	"2007"	"Arcobacter species have been historically associated with veterinary diseases, notably abortion and or other reproductive disorders. More recently however, A. butzleri and A. cryaerophilus have been recognised as human foodborne pathogens, most commonly associated with gastroenteritis, but also with cases of septicaemia. The lack of standardised detection techniques and the fact that Arcobacter isolation is not a routine hospital laboratory procedure has hindered accurate assessment of association of Arcobacter with human illness.This project optimised the isolation procedures for Arcobacter spp. The latest genotyping methods were applied and the genotype distribution was assessed. These procedures were used to examine the contamination of Irish foodstuffs."	"Queen's University Belfast"	""	""	""	""	"Madden, Robert"	"-1"	"-1"	"82"	"It is likely that the Principal Contractor and awardee institution on this project do not exist in investigator data and institution data. Please follow the link http://www.safefood.eu/Professional/Portfolio/1-Microbiology/Arcobacter-spp-in-retail-foodstuffs-in-Ireland-o.aspx to look for additional information about the investigator to be inserted into the database. The needed investigator fields are empty in this row."
"03–PG–011"	"A study of the factors controlling the survival, germination and outgrowth of Bacillus cereus in rice–based model foods using novel rapid flow cytometry methods and biochemical markers"	"http://www.safefood.eu/Professional/Portfolio/1-Microbiology/A-study-of-the-factors-controlling-the-survival,-g.aspx"	"2003"	"2006"	"The consumption of takeaway meals and cooked chilled foods containing rice is popular nowadays. The main pathogen associated with cooked rice is Bacillus cereus , which can cause emetic or diarrhoeal food poisoning. It poses a food safety hazard because of its ability to exist as dormant spores and sub–lethally injure vegetative cells after cooking.In this project, a rapid, precise, accurate, repeatable and sensitive flow cytometric method for detecting Bacillus cereus was developed capable of rapidly identifying and enumerating viable and spore–forming cells. The method was used to assess the impact of various processing, storage and cooking regimes on the survival and reactivation of Bacillus cereus in rice–based foods."	"University of Limerick"	""	""	""	""	"Wilkinson, Martin"	"-1"	"-1"	"82"	"It is likely that the Principal Contractor and awardee institution on this project do not exist in investigator data and institution data. Please follow the link http://www.safefood.eu/Professional/Portfolio/1-Microbiology/A-study-of-the-factors-controlling-the-survival,-g.aspx to look for additional information about the investigator to be inserted into the database. The needed investigator fields are empty in this row."
"Synergy project"	"Laboratory detection of Cryptosporidium parvum in foodstuffs - an inter–laboratory evaluation study"	"http://www.safefood.eu/Professional/Portfolio/1-Microbiology/Laboratory-detection-of-Cryptosporidium-parvum-in.aspx"	"2003"	"2004"	"Scientific knowledge on the prevalence of Cryptosporidium parvum and methods for the detection of the organism in food are still limited. Considered to be an emerging pathogen in Europe’s food and water chain, the actual risk it poses has yet to be fully determined. This project involved the development of an optimised protocol for the detection of Cryptosporidium parvum in vegetables for routine laboratory testing.The laboratories involved tested over one thousand samples of locally grown lettuce for this intestinal parasite. The occurrence was determined to be low (2% of samples); nonetheless, it highlighted the requirement for horticultural producers of lettuce to evaluate their HACCP systems to prevent contamination with this parasite."	"Northern Ireland Public Health LaboratoryDr Fiona Kenny"	""	"Sligo Public Health Laboratory"	""	""	"Moore, John"	"-1"	"-1"	"82"	"It is likely that the Principal Contractor and awardee institution on this project do not exist in investigator data and institution data. Please follow the link http://www.safefood.eu/Professional/Portfolio/1-Microbiology/Laboratory-detection-of-Cryptosporidium-parvum-in.aspx to look for additional information about the investigator to be inserted into the database. The needed investigator fields are empty in this row."
"03-RESR-001"	"Epidemiological assessment of Mycobacterium avium subsp. paratuberculosis (MAP) in target herds"	"http://www.safefood.eu/Professional/Portfolio/1-Microbiology/Epidemiological-assessment-of-Mycobacterium-avium.aspx"	"2003"	"2004"	"This research was commissioned in order to carry out follow-up veterinary investigation of suspect Mycobacterium avium subsp. paratuberculosis (MAP)-positive herds identified in an earlier safe food project.The objectives of this research were:"	"Cork County Council"	""	""	""	""	"Buckley, Jim"	"-1"	"-1"	"82"	"It is likely that the Principal Contractor and awardee institution on this project do not exist in investigator data and institution data. Please follow the link http://www.safefood.eu/Professional/Portfolio/1-Microbiology/Epidemiological-assessment-of-Mycobacterium-avium.aspx to look for additional information about the investigator to be inserted into the database. The needed investigator fields are empty in this row."
"02-PG-029"	"Incidence and survival of potential human pathogens in the production of the common cultivated mushroom (Agaricus bisporus)"	"http://www.safefood.eu/Professional/Portfolio/1-Microbiology/Incidence-and-survival-of-potential-human-pathogen.aspx"	"2002"	"2006"	"This project investigated the prevalence and potential risk of human pathogenic bacteria in cultivated mushrooms. Bacteria play an important role in the production of the mushroom fruiting body but other microorganisms, which cause mushroom disease, are still prevalent, despite prevention and control procedures. This gave rise to concerns that microbes harmful to humans may also be present. This research was especially timely considering the increase in consumption of ready-to-eat vegetables."	"University of Ulster"	""	"Coleraine"	""	""	"Naughton, Patrick"	"-1"	"-1"	"82"	"It is likely that the Principal Contractor and awardee institution on this project do not exist in investigator data and institution data. Please follow the link http://www.safefood.eu/Professional/Portfolio/1-Microbiology/Incidence-and-survival-of-potential-human-pathogen.aspx to look for additional information about the investigator to be inserted into the database. The needed investigator fields are empty in this row."
"00-RESR-060"	"Development of rapid tests for the detection of Mycobacterium paratuberculosis and their use to determine survival in food matrices"	"http://www.safefood.eu/Professional/Portfolio/1-Microbiology/Development-of-rapid-tests-for-the-detection-of-My.aspx"	"2001"	"2004"	"This project was run in collaboration with Food Institutional Research Measure (FIRM), examined a number of aspects of MAP. The project involved a survey of faeces and milk from high-risk herds using culture-based and molecular detection methods.The project also aimed to develop rapid methods for the detection of MAP in milk and other dairy products. The effect of different pasteurisation conditions on survival of MAP in milk was also under investigation."	"National Diagnostics Centre"	""	"Galway"	""	""	"Maher, Majella"	"-1"	"-1"	"82"	"It is likely that the Principal Contractor and awardee institution on this project do not exist in investigator data and institution data. Please follow the link http://www.safefood.eu/Professional/Portfolio/1-Microbiology/Development-of-rapid-tests-for-the-detection-of-My.aspx to look for additional information about the investigator to be inserted into the database. The needed investigator fields are empty in this row."
"00-RESR-046"	"Detection and molecular characterization of selected pathogenic organisms isolated from unpasteurised milk using milk filters"	"http://www.safefood.eu/Professional/Portfolio/1-Microbiology/Detection-and-molecular-characterization-of-select.aspx"	"2001"	"2004"	"Surveys have shown that a substantial proportion of farm families in the Republic of Ireland consume raw milk. This practice is inadvisable because of the risk of pathogenic microorganisms being present in the milk.As well as completing a survey of raw milk consumption by farm families, this study determined baseline values for the incidence of a number of pathogens including Mycobacterium avium subsp. paratuberculosis (MAP), Verocytotoxigenic Escherichia coli (VTEC), and Salmonella species in unpasteurised milk in commercial dairy herds in the Cork region of Ireland.  "	"Cork County Council"	""	""	""	""	", "	"-1"	"-1"	"82"	"It is likely that the Principal Contractor and awardee institution on this project do not exist in investigator data and institution data. Please follow the link http://www.safefood.eu/Professional/Portfolio/1-Microbiology/Detection-and-molecular-characterization-of-select.aspx to look for additional information about the investigator to be inserted into the database. The needed investigator fields are empty in this row."
"00-RESR-105"	"A harmonised system for approval and monitoring private laboratories testing for foodborne pathogens"	"http://www.safefood.eu/Professional/Portfolio/1-Microbiology/A-harmonised-system-for-approval-and-monitoring-pr.aspx"	"2005"	"2008"	"This project aimed to develop an agreed protocol for approval and monitoring testing for foodborne pathogens in private laboratories. The project organised a number of all-island inter-laboratory proficiency testing trials, as well as the development of a database of Salmonella tests and the compilation of a collection of isolates. This database and collection has been extended to include other bacteria."	"Department of Agriculture"	""	"Dublin"	""	""	"Egan, John"	"-1"	"-1"	"82"	"It is likely that the Principal Contractor and awardee institution on this project do not exist in investigator data and institution data. Please follow the link http://www.safefood.eu/Professional/Portfolio/1-Microbiology/A-harmonised-system-for-approval-and-monitoring-pr.aspx to look for additional information about the investigator to be inserted into the database. The needed investigator fields are empty in this row."
"04-2013"	"Protecting consumer choice: ensuring the provenance of artisan foods produced on the island of Ireland"	"http://www.safefood.eu/Professional/Portfolio/3-Chemistry-Toxicology/Protecting-consumer-choice-ensuring-the-provenanc.aspx"	"2013"	"2014"	"The provenance of processed foods is a significant quality attribute for many consumers. However, widespread mislabelling or adulteration of high-value foods is known to take place on a global scale and, with regard to Irish farmhouse cheeses, it is believed that the mislabelling of imported foreign cheeses as Irish does happen and may be a growing problem. There is also concern that not all cheeses sold with Irish-sounding brand names originate on the island of Ireland. An analytical effort is therefore warranted to facilitate the development of methods to confirm the ""Irish origin"" claims of such products. This project, which is a collaboration between Teagasc Food Research Centre, Ashtown and the Institute for Global Food Security in Queen’s University Belfast, aims to develop a robust fingerprint model which will characterise Irish-produced farmhouse cheeses using these analytical approaches. The possibility of labelling solutions to augment consumer choice will also be explored. "	"Teagasc Food Research Centre"	""	"Ashtown,Dublin"	""	""	"Downey, Gerard"	"-1"	"-1"	"82"	"It is likely that the Principal Contractor and awardee institution on this project do not exist in investigator data and institution data. Please follow the link http://www.safefood.eu/Professional/Portfolio/3-Chemistry-Toxicology/Protecting-consumer-choice-ensuring-the-provenanc.aspx to look for additional information about the investigator to be inserted into the database. The needed investigator fields are empty in this row."
